name,id,minutes,contributor_id,submitted,tags,n_steps,steps,description,ingredients,n_ingredients,cuisine,recipeIngredient,fiber,serving_size,nutrition_per_100g,calories,total_fat,sugar,sodium,protein,saturated_fat,energy_J,category,baseline_points,P_points,F_points,HSR_score,average_rating
shawarma,10392,735,10404,2001-07-24,"['beef', 'lamb-sheep']",8,"['combine yogurt , lemon juice , garlic , pepper sauce , vinegar , onion , black and cayenne pepper , mace , and salt', 'add meat and marinate overnight', 'grill the meat until done or broil in oven', 'combine the tahini , garlic , lemon juice , and parsley', 'whisk well', 'add water if needed', 'to make the sandwich slice open a pita , spread some tahini sauce on the bread and add some lettuce and sprouts , tomato , onion and meat', 'pour on a little tzatziki and chow down']",a very tasty grilled meat sandwich.,"['plain yogurt', 'lemon juice', 'garlic', 'hot pepper sauce', 'vinegar', 'onion', 'black pepper', 'cayenne pepper', 'mace', 'salt', 'beef', 'tahini', 'parsley', 'water', 'pita bread', 'tomatoes', 'sprouts', 'lettuce', 'tzatziki']",19,indian,"['1   cup    plain yogurt', '2   teaspoons    lemon juice', '4   cloves    garlic, minced ', '1/2  teaspoon    hot pepper sauce', '1   teaspoon    vinegar', '1   teaspoon    onion, finely minced ', '1/2  teaspoon    black pepper', '1/2  teaspoon    cayenne pepper', '1/2  teaspoon    ground mace', '1/2  teaspoon    salt', '2   lbs    chicken or 2   lbs    lamb, sliced very thin ', '1   cup    tahini', '2   cloves    garlic, minced ', '2   teaspoons    lemon juice', '2   teaspoons   chopped parsley', '1/2  cup    water', '8   slices    pita bread', ' sliced tomatoes', ' sliced onion', '  mixed sprouts', '  lettuce, sliced thin ', '  tzatziki']",4.3,256,"[439.53, 57.81, 3.52, 8.59, 16.41, 70.7, 5.47]",439.53,57.81,3.52,8.59,16.41,70.7,1838.99352,1D,16,8,4,4.0,4.57
spicy yam curry,304057,45,37636,2008-05-18,['vegetables'],8,"['heat mustard oil or ghee in a large saucepan and add cumin seed', 'cook 30 seconds or until fragrant , but do not burn', 'add chopped onion , garlic , and cayenne pepper , cooking for several minutes or until onions begin to soften', 'stir in diced yam , diced tomatoes , salt , and curry powder', 'mix tamarind paste with warm water and add to pan', 'reduce heat , cover and simmer for 20-25 minutes , stirring occasionally , or until yam is tender , adding water if necessary to keep from sticking', 'stir in thawed peas and cook for 1-2 minutes more , or until peas are tender', 'serve garnished with chopped cilantro , with freshly steamed basmati rice']","the yam in this (suran), is related to the sweet potato. however, that being said, do not look for a marshmallow topped, brown sugar filled concoction. this is definitely all curry, and is a bit spicy as well. eat as a vegetarian main dish, or as a side dish to other recipes. if you cannot find suran, just substitute sweet potato or white potatoes. i am sure they would work well.","['mustard oil', 'cumin seed', 'onion', 'garlic cloves', 'cayenne pepper', 'yams', 'tomatoes with juice', 'salt', 'mild curry powder', 'tamarind paste', 'water', 'peas', 'cilantro']",13,indian,"['2   tablespoons    mustard oil or 2   tablespoons    ghee', '1   teaspoon    cumin seed', '1       onion, chopped ', '3       garlic cloves, minced ', '1/2  teaspoon    cayenne pepper (add as much as you want)', '14   ounces   suran yams, cut into cubes ', '14 1/2  ounces    diced tomatoes with juice', '1/2  teaspoon    salt', '1 -2   tablespoon    mild curry powder (to taste)', '1/2  teaspoon    tamarind paste', '1/2  cup    warm water', '1/2  cup    frozen peas, thawed ', '2   tablespoons   chopped cilantro (coriander leaf)']",9.5,288,"[111.53, 5.21, 12.15, 10.42, 3.47, 2.08, 6.25]",111.53,5.21,12.15,10.42,3.47,2.08,466.64152,3,5,2,9,5.0,4.67
vegan chickpea korma,271664,55,613457,2007-12-13,['beans'],9,"['combine the tomato paste , garlic , curry powder , cardamom , coriander , and a bit of the vegetable oil to make a paste', 'set aside', 'fry the chopped onion in vegetable oil until soft', 'stir curry paste mixture into the onion and fry together for a minute', 'stir the coconut milk into the onion / curry paste mixture in the pan to create the sauce and heat through to bubbling', 'add in the bell pepper and chickpeas', 'stir together , and then stir in ginger and cayenne pepper', 'bring to bubbling and then cover and reduce heat', 'simmer for 15 minutes']",you can serve this over rice or as is.,"['chickpeas', 'coconut milk', 'onion', 'red bell pepper', 'vegetable oil', 'tomato paste', 'garlic clove', 'ginger', 'curry powder', 'cardamom', 'coriander', 'cayenne pepper']",12,indian,"['15 1/2  ounces    chickpeas (I use low sodium)', '13 1/2  ounces    coconut milk', '1   medium    onion, chopped small ', '1   small    red bell pepper, coarsely chopped ', '3   tablespoons    vegetable oil', '2   tablespoons    tomato paste', '1       garlic clove, minced ', '1   tablespoon    ginger', '3   tablespoons    curry powder', '1   teaspoon    ground cardamom', '1   teaspoon    ground coriander', '  cayenne pepper']",6.7,222,"[225.09, 15.77, 78.38, 6.31, 5.86, 30.63, 10.36]",225.09,15.77,78.38,6.31,5.86,30.63,941.77656,2D,24,3,7,2.5,4.0
pork biryani,353160,135,384210,2009-01-31,"['pork', 'rice', 'pasta']",20,"['mix the pork in a bowl with the ginger , garlic , garam masala , chili powder , tumeric , chillies , mint and coriander', 'cover and refrigerate overnight', 'the next day , put the sliced onion in a colander , sprinkle with salt to draw liquid out of the onions', 'discard liquid , rinse onions and pat dry', 'heat oil and butter in a dutch oven , then fry onions until golden brown', 'remove onions and drain', 'pour off and reserve all but about 2 tbsp of the butter and oil', 'fry the pork in the dutch oven until well browned', 'add cooked onions and yogurt and cook on low for 40 minutes', 'in a large saucepan , boil enough water to cover rice', 'add rice , return to the boil , and cook 5 minutes', 'drain rice , spread on top of onions and pork in dutch oven', 'drizzle with lemon juice , saffron / milk mixture , and the leftover butter and oil', 'preheat the oven to 425 fahrenheit', 'make a dough by adding a little water to the flour and 1 tsp salt', 'roll dough into a long , thin sausage shape , and press along the top rim of the dutch oven', 'when the lid is placed on this dough , it will form a seal between the lid and base of the dutch oven', 'cook sealed dutch oven on high heat for 5 minutes before transferring to oven', 'bake in oven for 40 minutes', 'remove from oven , break dough seal and enjoy']","adapted from a recipe in the essential rice cookbook. nice flavor, good indian food for people who don't like curry (although i don't know why one would dislike curry). meat was extremely tender and juicy. ps: if you're one of those like me who doesn't like to measure, go easy on the lemon juice so that you don't overpower the saffron.","['pork', 'gingerroot', 'garlic cloves', 'garam masala', 'chili powder', 'turmeric', 'green chilies', 'mint', 'coriander', 'basmati rice', 'onion', 'salt', 'oil', 'butter', 'plain yogurt', 'saffron thread', 'milk', 'lemon juice', 'flour']",19,indian,"['2   lbs    pork loin, cut into 1 inch cubes ', '3   inches   piece gingerroot, grated ', '2       garlic cloves, crushed ', '2   tablespoons    garam masala (an Indian spice, you can probably find it with the spices at the store)', '1/2  teaspoon    chili powder', '1/2  teaspoon    ground turmeric', '4       green chilies, finely chopped ', '3   tablespoons   chopped mint', '4   tablespoons    ground coriander', '2 1/2  cups    basmati rice', '4       onions, thinly sliced ', '  salt', '1/2  cup    oil', '4   ounces    butter, melted ', '8   ounces    plain yogurt', '1/2  teaspoon    saffron thread, soaked in ', '2   tablespoons   hot milk', '1   tablespoon    lemon juice', '1 1/3  cups    whole wheat flour (barley, wheat, etc)', '1   teaspoon    salt']",9.1,468,"[229.89, 19.66, 6.2, 5.56, 18.59, 22.44, 6.62]",229.89,19.66,6.2,5.56,18.59,22.44,961.8597599999999,1D,14,9,9,5.0,5.0
yogurt cheese with hot nut topping,174349,20,37449,2006-06-21,"['eggs-dairy', 'fruit']",11,"['pour the yogurt into a cheesecloth lined coolander over a bowl', 'cover and leave it overnight at room temperature', 'the next day , discard the liquid whey(save to use in a smoothie or add to bread when making , and place the yogurt ""cheese"" in a bowl', 'add the honey , cardamom , nutmeg and cinnamon', 'mix well', 'chill the cheese spice mixture in the refrigerator', 'just before serving , heat the 2 tbls', 'honey gently in a saucepan and stir in the nuts', 'heat on low heat for 2-3 minutes , until the nuts are hot and well coated', 'spoon the cheese mixture into serving bowls , pour the nut sauce over and serve immediately', 'enjoy !']","exotic and delicious! this dessert is made in india and africa! this is good on it's own, but served with fruit, it's great!","['plain yogurt', 'honey', 'cardamom', 'nutmeg', 'cinnamon', 'nuts']",6,indian,"['4   cups    plain yogurt', '1/4  cup    honey', '1   teaspoon    ground cardamom', '1/2  teaspoon    nutmeg', '1/2  teaspoon    cinnamon', '2   tablespoons    honey', '1   cup    mixed nuts (peanuts, almonds, walnuts, etc.)']",3.5,312,"[145.22, 12.5, 50.0, 4.49, 9.29, 11.86, 4.81]",145.22,12.5,50.0,4.49,9.29,11.86,607.6004800000001,2D,23,5,3,2.0,5.0
basmati rice seasoned with garam masala,6582,30,148316,2000-03-06,"['rice', 'pasta']",8,"['preheat oven to 350f', 'in a medium stove-to-oven pot melt butter over medium heat', 'add chopped onions , garlic and garam masala and cook 3 to 5 minutes , stirring until onions are softened', 'add rice and stir until well coated', 'add vegetable stock , salt and pepper to taste', 'bring to a boil', 'cover and bake in the oven until the rice is tender and the stock is absorbed , about 20 to 25 minutes', 'let stand , covered for 5 minutes before serving']",this is a recipe that's delicious and will go well with your favorite curry.,"['basmati rice', 'butter', 'onion', 'garlic', 'garam masala', 'black pepper', 'vegetable broth']",7,indian,"['2   cups    basmati rice', '4   tablespoons    butter', '1   medium-size    onion, chopped ', '1   clove    garlic, minced ', '1   teaspoon    garam masala', '1       salt & freshly ground black pepper, to taste ', '4   cups    vegetable broth']",2.5,92,"[330.54, 15.22, 5.43, 3.26, 10.87, 28.26, 17.39]",330.54,15.22,5.43,3.26,10.87,28.26,1382.97936,1D,16,6,2,3.5,5.0
batatya chi sukki bhaji  sauteed potatoes and bell pepper,75126,55,6357,2003-11-02,['vegetables'],11,"['boil potatoes till cooked but firm', 'peel and cube them', 'sprinkle with salt , turmeric powder and paprika', 'mix well', 'heat oil in a pan', 'toss in cumin seeds and stir-fry for a few seconds', 'saute the potatoes for a few minutes', 'lower flame and cook covered till lightly roasted and golden', 'stir in the red and green bell peppers', 'cook for a few minutes', 'serve hot with rotis or bread or puris or parathas']",this is from the weekend magazine.,"['potatoes', 'red bell pepper', 'green bell pepper', 'oil', 'cumin seed', 'turmeric powder', 'paprika', 'salt']",8,indian,"['3   medium    potatoes', '1/2      red bell pepper, cubed ', '1/2      green bell pepper, cubed ', '3   tablespoons    oil', '1/2  teaspoon    cumin seed', '1/2  teaspoon    turmeric powder', '1/2  teaspoon    paprika', '  salt']",5.7,267,"[111.24, 7.87, 4.49, 0.0, 3.37, 3.75, 4.87]",111.24,7.87,4.49,0.0,3.37,3.75,465.42816,3,4,2,6,5.0,4.0
peshawari naan bread  bread machine,294013,130,780549,2008-03-25,['breads'],12,"['add all ingredients to your bread machine in the order your machine recommends', ""if your machine recommends pre-heated liquids , just heat the skimmed milk till it's lukewarm"", 'start your machine on the dough setting', '10-15 minutes before your machine stops mixing and starts proving , add the sultanas', 'preheat your oven to 250c and have 3 shelves in it', 'grease 3 flat oven trays', 'when the bread machine has finished ,', 'tear off a chunk of dough about 1 sixth of the total size and flatten out with the hands to a pear shape about half the size of your tray', ""do not use a roller as the bread probably won't rise"", 'repeat till you have 6 naans on your trays', 'bake in the oven for about 7 minutes , or until the bread just begins to colour', 'the bread can be frozen in bags for later use']","a traditional indian bread from peshawar.
i have used ingredients easily available in uk, together with british measurements.","['skim milk', 'olive oil', 'yogurt', 'egg', 'flour', 'desiccated coconut', 'sultanas', 'sugar', 'salt', 'yeast']",10,indian,"['6   fluid ounces    skim milk', '4   tablespoons    olive oil', '5   fluid ounces    low-fat yogurt (I use zero fat Greek)', '1   large    egg', '1   lb    strong white flour (or extra strong)', '4   ounces    desiccated coconut', '4   ounces    sultanas', '1   tablespoon    sugar', '1   teaspoon    salt', '1 (7   g) packet   bread machine quick-acting active dry yeast']",3.6,188,"[292.55, 13.83, 50.0, 10.64, 13.3, 19.15, 15.43]",292.55,13.83,50.0,10.64,13.3,19.15,1224.0292000000002,2D,25,7,3,2.0,4.67
pepper chicken,13150,10,21967,2001-10-24,['chicken'],7,"['heat oil in a cooking pan', 'add the mustard seeds and wait until they start to crackle', 'add the chopped onions and pepper and saute till the onions are tender', 'add the ginger garlic paste , saute for a couple of minutes', 'now add the pieces of chicken and salt and mix well', 'cover the lid and let the chicken cook in the juices for 5 minutes , on a low flame', 'uncover and cook for 5 more minutes on a high flame']",this was my grandmothers favorite which was simply passed on. everybody loves it,"['chicken', 'pepper', 'ginger-garlic paste', 'mustard seeds', 'onion', 'salt', 'cooking oil']",7,indian,"['1   kg    chicken (medium pieces)', '3   teaspoons    ground pepper', '1   teaspoon    ginger-garlic paste', '1/2  teaspoon    mustard seeds', '1       red onions or 1       white onion', '  salt', '3   teaspoons    cooking oil']",0.9,283,"[132.3, 14.13, 1.41, 1.41, 20.14, 12.37, 0.35]",132.3,14.13,1.41,1.41,20.14,12.37,553.5432000000001,1D,12,10,0,4.5,2.0
chickpeas and rice,195593,35,335585,2006-11-14,"['beans', 'rice', 'pasta']",6,"['cook water , rice , thyme , and bay leaf and set aside', 'heat olive oil and half of the butter in a skillet and then add chickpeas', 'when chickpeas start to lightly brown add parsley and the sun-dried tomatoes and cook for an additional 5 minutes', 'add oregano , basil , salt , and pepper and cook for an additional 1-2 minutes', 'remove from heat and mix rice and chickpeas together until rice is a golden color', 'mix in remaining butter and parmesan cheese']",this is a recipe that i got from a vegetarian cookbook and made a few modifications to.  we have fallen for this dish and now make it a few times a month.  my two year old also loves it.  we tried it out on some non-vegetarians and they all loved it.,"['chickpeas', 'butter', 'olive oil', 'parsley', 'sun-dried tomatoes packed in oil', 'basil', 'oregano', 'salt', 'pepper', 'parmesan cheese', 'thyme', 'bay leaf', 'basmati rice', 'water']",14,indian,"['1 (15   ounce) can   chickpeas', '2   tablespoons    butter', '2   tablespoons    olive oil', '1/3  cup    parsley', '2   tablespoons    sun-dried tomatoes packed in oil', '1   teaspoon    dried basil', '1   teaspoon    dried oregano', '1   teaspoon    salt', '1   teaspoon    pepper', '1/3  cup    parmesan cheese', '1   teaspoon    dried thyme', '1       bay leaf', '1   cup    basmati rice (uncooked)', '2   cups    water']",7.1,304,"[150.26, 8.88, 0.66, 14.8, 8.22, 10.53, 6.58]",150.26,8.88,0.66,14.8,8.22,10.53,628.6878399999999,1D,11,5,7,5.0,4.45
spicy mushroom rice,482881,20,107135,2012-07-10,"['rice', 'vegetables', 'pasta']",8,"['put oil or ghee or butter', 'saute garlic fry til turns dark', 'add pepper and cumin', 'add mushrooms', 'and salt', 'til mushroom cooked', 'add rice cook on low 5 minutes', 'til liquid from mushrooms is absorbed']",zaar world tour 8  indian,"['mushroom', 'rice', 'ghee', 'garlic', 'peppercorn', 'cumin', 'turmeric', 'coriander']",8,indian,"['1   lb    mushroom, sliced ', '6   cups    rice, cooked ', '2   tablespoons    ghee, butter ', '3   teaspoons    garlic, minced ', '1   teaspoon    peppercorn, crushed ', '2   teaspoons    cumin, crushed ', '1/4  teaspoon    turmeric', '2   tablespoons    coriander, minced ']",3.7,278,"[274.24, 2.88, 2.16, 0.0, 11.15, 5.4, 18.71]",274.24,2.88,2.16,0.0,11.15,5.4,1147.4201600000001,3,8,6,3,5.0,5.0
two step tasty tofu scramble,28273,19,6164,2002-05-13,['beans'],7,"['heat oil and add salt , red chilli powder , onions , celery and tomatoes', 'saute on medium heat for 3 minutes', 'add tofu and cook on low heat for 8 minutes', 'stir very gently', 'serve with rice , pasta or pita / indian breads !', 'optional: you can sprinkle one tsp', 'of garam masala in the end to make it more aromatic']",i discovered a new taste of tofu...now come and share the same !,"['firm tofu', 'onion', 'celery', 'tomatoes', 'salt', 'red chili powder', 'oil']",7,indian,"['2   cups    firm tofu, cubed ', '1   big    onion, chopped ', '2   stalks    celery, chopped ', '2   medium    tomatoes, chopped ', '  salt', '1   teaspoon    red chili powder', '2   tablespoons    oil']",2.4,189,"[71.9, 7.41, 8.47, 0.53, 6.35, 3.7, 1.06]",71.9,7.41,8.47,0.53,6.35,3.7,300.8296,3,4,3,2,5.0,3.0
curried lentils with spinach,309136,35,232886,2008-06-13,['beans'],8,"['wash lentils', 'cook till tender but firm', 'heat olive oil in large pot & when hot add garlic', 'sautee for 1 minute', 'add spinach leaves & steam till they wilt', 'add lentils & rest of ingredients', 'cover & simmer for 15 minutes', 'serve over rice']","from nava atlas, ""vegetariana""

pretty tasty, very easy. needs a little something. i thought it
would be good with shrimp in it, joe (dh) suggested some heat (hot bean
paste?). maybe cubes of butternut squash? if anyone comes up with something fabulous, please share!","['lentils', 'olive oil', 'garlic cloves', 'spinach leaves', 'plum tomatoes', 'tamari', 'curry powder', 'ginger', 'cinnamon', 'nutmeg']",10,indian,"['1   cup    lentils', '1   tablespoon    olive oil', '2       garlic cloves, minced ', '1/2  lb    spinach leaves, washed, stemmed & chopped ', '14   ounces    canned plum tomatoes', '2   tablespoons    tamari or 2   tablespoons    soy sauce', '2   teaspoons    curry powder', '1/4  teaspoon    ginger', '1/4  teaspoon    cinnamon', '1/4  teaspoon    nutmeg']",6.7,221,"[62.76, 2.71, 8.6, 14.48, 7.24, 1.36, 2.71]",62.76,2.71,8.6,14.48,7.24,1.36,262.58784,3,2,4,7,5.0,2.75
chicken in green masala sauce,294385,40,800823,2008-03-25,['chicken'],7,"['place the apple , 3 tbsp of coriander , mint , yogurt , ricotta , chillies , scallions , salt , sugar , garlic , and ginger in a food processer and process for 1 minute', 'scrape around the outside of the bowl and process for a few seconds more', 'heat the oil in a wok or a large pan , pour the yogurt mixture and cook gently over low heat for about 2 minutes', 'add the chicken pieces and stir well to blend everything together', 'cook over a medium-low heat for 12-15 minutes or until the chicken is fully cooked', 'sprinkle the raisins and remaining cilatro over the chicken', 'plate and serve']","the use of green spice is very popular in india, which makes a delcious accompiament to the recipe.","['green apple', 'cilantro leaves', 'mint leaves', 'plain yogurt', 'ricotta cheese', 'green chilies', 'scallion', 'salt', 'sugar', 'garlic', 'gingerroot', 'vegetable oil', 'chicken', 'golden raisin']",14,indian,"['1       green apple, peeled, cored, and cubed ', '4   tablespoons    fresh cilantro leaves', '2   tablespoons    fresh mint leaves', '2/3  cup    plain yogurt', '3   tablespoons    ricotta cheese', '2       fresh green chilies, seeded and chopped ', '1   bunch    scallion, chopped ', '1   teaspoon    salt', '1   teaspoon    granulated sugar', '1   teaspoon   crushed garlic', '1   teaspoon   grated gingerroot', '1   tablespoon    vegetable oil', '8   ounces    skinless chicken breasts, cubed ', '1   ounce    golden raisin']",3.8,293,"[73.79, 3.75, 18.43, 9.22, 12.63, 4.1, 2.39]",73.79,3.75,18.43,9.22,12.63,4.1,308.73736,3,8,7,4,5.0,4.0
carrot burfi,19524,90,6923,2002-02-12,['vegetables'],9,"['in a large skillet , cook the grated carrots and sugar , covered , for about 20 minutes', 'add the dry milk', 'cook , stirring occasionally to avoid sticking at bottom , until no moisture is left', 'stir in the butter', 'cook on medium heat until the mixture is of desired consistency that can be spread on a tray and cut into pieces', 'add more dry milk as needed', 'mix in the cardamoms and spread on a 9 by 13 inches greased cookie sheet', 'garnish with nuts', 'cut into squares when cold']","carrots are used widely in india, not only as vegetable, but also to make drinks, pudding and fudge. this fudge can be refrigerated or frozen for quite a long time.","['carrots', 'sugar', 'nonfat dry milk powder', 'butter', 'cardamom seed', 'blanched almond', 'cashews']",7,indian,"['3   lbs    carrots, scraped and grated ', '2 1/2  cups    sugar', '3   cups    nonfat dry milk powder', '2   ounces cups   unsalted butter', '1   teaspoon   coarsely crushed cardamom seed', '1/4  cup   chopped blanched almond', '1/4  cup   chopped cashews']",1.1,2382,"[4.13, 0.08, 2.6, 0.08, 0.25, 0.13, 0.21]",4.13,0.08,2.6,0.08,0.25,0.13,17.27992,3,0,0,1,5.0,5.0
indian spiced peas with tofu,226106,30,137650,2007-05-03,"['beans', 'vegetables']",8,"['in a cast iron or heavy saucepan , heat about 1"" oil until hot but not smoking', 'toss tofu cubes with corn starch and fry in a single layer until golden brown on all sides', 'carefully remove with a slotted spoon and set aside', 'let oil cool slightly and drain off all but about 1 / 4 cup', 'reheat and saut onions and ginger until onions are golden brown', 'add garam masala and tomatoes and simmer 5 minutes', 'add 1 / 2 cup water , peas and fried tofu , cover and lower heat , simmer an additional 1015 minutes', 'season to taste']",from whole foods meals for 4 under $15.,"['canola oil', 'firm tofu', 'cornstarch', 'onion', 'ginger', 'garam masala', 'tomatoes', 'green peas', 'black pepper']",9,indian,"['1/8  cup    canola oil', '1 (14   ounce) package   extra firm tofu, excess water removed, cut into 1/2-inch cubes ', '3   tablespoons    cornstarch', '2       yellow onions, very thinly sliced ', '1   tablespoon    fresh ginger, finely minced ', '1   tablespoon    garam masala', '1 (28   ounce) can   diced tomatoes, undrained ', '1 (8   ounce) package   frozen green peas, defrosted ', ' sea salt & freshly ground black pepper']",6.9,485,"[56.1, 3.51, 10.93, 4.33, 5.36, 1.44, 2.27]",56.1,3.51,10.93,4.33,5.36,1.44,234.72240000000002,3,3,3,7,5.0,4.0
tangy mango mousse,23221,150,30716,2002-03-24,['fruit'],16,"['whisk gelatine into hot water with a fork and set aside', 'beat egg yolks and sugar until creamy', 'stir in mango puree , gelatine , lemon juice and rind', 'whip cream until stiff and fold into mango mixture', 'beat egg whites until stiff and lightly fold through mango mixture until well combined', 'pour mousse into 6 individual lightly greased one-cup moulds or one 1', '5-litre mould', 'refrigerate 2 hours or until set', 'for the sauce combine the water and sugar in a small saucepan and stir over low heat to dissolve sugar', 'bring to the boil without stirring', 'reduce heat', 'simmer until liquid is reduced by half', 'stir in passionfruit and simmer for 2 minutes', 'cool', 'serve mousse with sauce and fresh mango slices', 'warning: as the mousse contains uncooked egg do not give to pregnant persons']","i really want to try this, but haven't yet. tell me how it goes.","['gelatin', 'water', 'eggs', 'sugar', 'mangoes', 'lemon juice', 'lemon rind', 'cream', 'passion fruit']",11,indian,"['1   tablespoon    gelatin', '1/4  cup    hot water', '4       eggs, separated ', '1/2  cup    caster sugar', '2   small    mangoes, pureed ', '2   teaspoons    lemon juice', '1/2  teaspoon    fresh lemon rind', '1   cup    cream', '1   cup    water', '1/2  cup    sugar', '4       passion fruit (pulp of)']",2.3,260,"[133.15, 9.23, 66.15, 0.77, 5.0, 16.54, 5.77]",133.15,9.23,66.15,0.77,5.0,16.54,557.0996,2D,23,3,2,1.5,3.33
curried salmon burger,80231,15,30716,2004-01-06,"['seafood', 'fish']",7,"['combine salmon , oats , eggs and curry powder in a bowl', 'mix well', 'divide the mixture into 4 equal portions', 'shape each portion into a 8cm patty', 'heat a large non-stick pan and spray with cooking oil', 'add the salmon patties and cook for 3 minutes each side or until browned and cooked through', 'serve with minted yoghurt , if desired and vegetables']",a tasty way to have fish for dinner.,"['pink salmon', 'oats', 'eggs', 'madras curry powder']",4,indian,"['1 (415   g) can   pink salmon, drained and flaked ', '1/3  cup   1 instant oats', '2       eggs', '3   teaspoons    Madras curry powder']",1.2,137,"[137.15, 7.3, 0.73, 2.92, 36.5, 5.11, 0.73]",137.15,7.3,0.73,2.92,36.5,5.11,573.8356,3,6,13,1,5.0,4.0
