name,id,minutes,contributor_id,submitted,tags,n_steps,steps,description,ingredients,n_ingredients,cuisine,recipeIngredient,fiber,serving_size,nutrition_per_100g,calories,total_fat,sugar,sodium,protein,saturated_fat,energy_J,category,baseline_points,P_points,F_points,HSR_score,average_rating
italian sub pasta salad,243568,25,199848,2007-07-31,"['salads', 'vegetables']",8,"['make sure your pasta has cooled completely', 'in a large bowl , toss together pasta , tomatoes , cucumber , red bell pepper , shredded lettuce , chopped onion , sliced black olives , ham , salami and provolone', 'in a jar or crouet , pour all the dressing ingredients', 'shake very very well', 'pour over the salad and toss to coat evenly', 'serve', 'if not eating right away , give another good mix / toss before serving', 'best if eaten the same day as prepared']",tastes like an italian sub.... but it's a salad!  nice for summer picnics.  best if eaten the day prepared.,"['rotini pasta', 'grape tomatoes', 'cucumber', 'red bell pepper', 'iceberg lettuce', 'onion', 'black olives', 'cooked ham', 'hard salami', 'provolone cheese', 'virgin olive oil', 'red wine vinegar', 'salt', 'garlic powder', 'pepper', 'sugar', 'oregano']",17,italian,"['8   ounces    rotini pasta, cooked drained and cooled ', '1   cup    grape tomatoes, cut in halves ', '1   cup   diced cucumber', '1/2  cup   diced red bell pepper', '2   cups   shredded iceberg lettuce, packed ', '1/2  cup   chopped red onion', '1/2  cup   sliced black olives', '4   ounces   diced cooked ham', '4   ounces   diced hard salami', '4   ounces   cubed provolone cheese', '1/3  cup    extra virgin olive oil', '1/2  cup    red wine vinegar', '1/4-1/2  teaspoon    salt', '1/4-1/2  teaspoon    garlic powder', '1/2  teaspoon    pepper', '1/2  teaspoon    sugar', '1   teaspoon    oregano']",2.1,0,"[0, 0, 0, 0, 0, 0, 0]",0.0,0.0,0.0,0.0,0.0,0.0,0.0,3,0,0,2,5.0,4.8
andy s garlic bread,71461,30,93698,2003-09-15,['breads'],7,"['pre-heat oven to 350f', 'mince garlic and stir into butter', 'slice bread into thick slices , about 3 / 4""', 'spread one side of each slice with butter mixture , then sprinkle with parsley flakes', 're-arrange slices into loaf', 'wrap with aluminum foil', 'bake for 15-20 minutes']","this is definitely a garlic lover's garlic bread. if one person eats it for dinner, everyone ought to eat it. everything up to baking the loaf can easily be done by children.","['butter', 'garlic', 'french bread', 'parsley flakes', 'aluminum foil']",5,italian,"['1/4  lb    butter, room temperature ', '2   cloves    garlic, minced ', '1   loaf    French bread', '  parsley flakes', '  aluminum foil']",1.7,0,"[0, 0, 0, 0, 0, 0, 0]",0.0,0.0,0.0,0.0,0.0,0.0,0.0,3,0,0,1,5.0,4.0
cheesy toasted ravioli with pesto,446122,20,318262,2011-01-10,"['eggs-dairy', 'pasta', 'vegetables', 'cheese']",10,"['adjust oven rack to upper middle position and heat broiler', 'melt butter in a large nonstick skillet over med-high heat', 'add ravioli and cook , stirring occasionally , until golden brown , 3-5 minutes', 'stir in broth and cream and cook , covered until ravioli are nearly tender , about 3 minutes', 'remove lid and continue to cook until sauce is slightly thickened and ravioli are completely tender , about 3 minutes', 'off heat , stir in pesto and 1 / 4 cup cheese into pan with ravioli', 'transfer to broiler safe 1 1 / 2 quart casserole dish', 'arrange tomatoes over ravioli and season with salt and pepper to taste', 'sprinkle with remaining cheese and broil until surface is spotty brown , about 3 minutes', 'serve']","a different way of preparing ravioli - they aren;t baked or boiled but browned in butter, simmered in broth and cream and finished in a broiler with pesto, goat cheese and tomatoes. from cook's country april/may 2010. 
make sure to use homeade or store-bought refrigerated pesto. the shelf-stable pesto won't taste as good.","['butter', 'ravioli', 'chicken', 'heavy cream', 'basil pesto', 'goat cheese', 'plum tomatoes', 'salt', 'pepper']",9,italian,"['1   tablespoon    unsalted butter', '2 (9   ounce) packages  fresh ravioli (type of your choice)', '1   cup    low sodium chicken broth or 1   cup    vegetable broth', '1/3  cup    heavy cream', '1/4  cup   fresh basil pesto', '1/2  cup   crumbled goat cheese', '3       plum tomatoes, sliced in 1/4 inch rounds ', '  salt', '  pepper']",2.2,0,"[0, 0, 0, 0, 0, 0, 0]",0.0,0.0,0.0,0.0,0.0,0.0,0.0,3,0,0,2,5.0,4.0
awesome and easy spaghetti casserole,33553,60,47927,2002-07-08,"['beef', 'pasta']",10,"[""optional: mushrooms , tabasco sauce and tony's cajun seasoning to spice it up"", ""sautee' butter , chopped garlic , sugar , salt , and pepper in a skillet"", 'add meat and brown', 'add tomato sauce and simmer 20 minutes', 'cook and drain noodles', 'add cream cheese , sour cream , and onion', 'mix well and layer in the bottom of a casserole dish', 'top noodles with the meat mixture and top with grated cheese', 'bake at 350 for 30 minutes', 'allow 10 minutes to cool before serving']",this is a great alternative to spaghetti! it also freezes and is perfect for large gatherings. a vegetarian option is to omit the meat and use spinach instead.,"['butter', 'garlic clove', 'onion', 'sugar', 'salt', 'pepper', 'beef', 'tomato sauce', 'spaghetti noodles', 'cream cheese', 'sour cream', 'cheese']",12,italian,"['2   tablespoons    butter', '1       garlic clove', '1/2  cup   chopped onion', '1   tablespoon    sugar', '1   teaspoon    salt', '1   teaspoon    pepper', '1 1/2  lbs    ground beef', '2 (8   ounce) cans   tomato sauce', '1 (8   ounce) package   spaghetti noodles', '3   ounces    cream cheese', '1 1/2  cups    sour cream', '1/2  lb   grated cheese']",3.8,0,"[0, 0, 0, 0, 0, 0, 0]",0.0,0.0,0.0,0.0,0.0,0.0,0.0,3,0,0,4,5.0,5.0
lasagna with caramelized onions  roasted peppers   squash,358726,180,565592,2009-03-02,"['pasta', 'vegetables']",44,"['make the pasta:', 'combine flour , salt , and basil in food processor and pulse once or twice to mix', 'add eggs all at once and process 30 seconds or so till dough pulls away from the sides and forms a ball', 'add more flour if dough is too sticky , or more water if dough is grainy', 'wrap in plastic and set aside on the counter to rest for at least 30 minutes', 'make the veggie layer:', 'preheat oven to 400f drizzle a large baking sheet with 1 t', 'olive oil', 'spread squash and bell pepper on the sheet and drizzle with remaining 1 t', 'olive oil', 'sprinkle with salt and pepper to taste , toss gently and roast in preheated 400f oven for 20 minutes or so when done , transfer to a bowl', 'set aside', 'meanwhile , in a large heavy skillet with a lid , heat 1 / 4 celsius olive oil over low heat', 'add onion rings', 'drizzle with a little more olive oil if needed and cook , stirring infrequently , till translucent and golden , 30 minutes or so', 'when onions are done , transfer to the bowl with roasted veggies with slotted spoon , allowing any excess oil to drip into the pan', 'wipe oil out of pan with a paper towel and place 1 celsius water in pan', 'heat water till steaming , then add the kale', 'steam 5-7 minutes , till bright green and tender', 'add to bowl with onions and roasted veggies and toss', 'make the marinara:', 'heat olive oil in 2 quart saucepan over medium heat', 'till shimmery', 'add fennel and cook 3-4 minutes , stirring occasionally , till softened', 'add tomatoes and their juice , vinegar and fennel seed', 'simmer 10-15 minutes , till heated through', 'puree with an immersion blender', 'set aside', 'cook the pasta:', 'bring a large pot of salted water to a vigorous boil', 'breaking the pasta dough into 3 equal portions , roll out on a floured surface till dough is roughly 1 / 4"" thick', 'cut into long wide noodles', 'when all noodles are rolled out , drop noodles into boiling water and cook no more than a minute', ""drain thoroughly and lay noodles flat on a kitchen towel so they don't stick together"", 'assemble lasagna !', 'preheat oven to 375f spray a 9"" by 13"" glass baking dish with olive oil', 'spread a thin layer of marinara over the bottom and top with a layer of noodles , covering the bottom completely', 'top with 1 / 2 the veggie mixture , 1 / 3 the ricotta , 1 / 3 the romano , and another layer of sauce', 'begin a new layer of noodles and top with remaining veggie mixture , 1 / 3 the ricotta , 1 / 3 the romano , and another layer of sauce', 'top with remaining noodles , remaining sauce , remaining ricotta and romano', 'place assembled lasagna in 375 deg', 'oven', 'bake for 30 minutes , till sauce is bubbly and cheese on top is melted', 'let rest at least 15 minutes before serving']","a labor of love (or something like that).  it takes a few hours to put together if you're starting from scratch--i generally use leftover roasted veggies/onionssauce if possible, but it's well worth it however you make it! of course, you can simplify and skip making your own noodles, buy prepared marinara sauce, and use leftover roasted veggies, whatever floats your boat!","['flour', 'salt', 'basil', 'eggs', 'olive oil', 'onion', 'winter squash', 'red bell pepper', 'kale', 'fennel bulb', 'tomatoes', 'balsamic vinegar', 'fennel seed', 'milk ricotta cheese', 'romano cheese']",15,italian,"['2   cups    whole wheat flour (or other grain)', '1   teaspoon    salt', '1/4  cup   chopped fresh basil', '3       eggs', '1/4  cup   tbsps olive oil', '2   tablespoons    olive oil', '5   medium    onions, peeled and cut into 1/2-inch thick rings ', '2   cups   cubed winter squash', '1   cup   chopped red bell pepper', '1   large   bunch kale, stemmed and torn into bite-size pieces ', '1   teaspoon    olive oil', '1   small    fennel bulb, diced  (or onion)', '1 (24   ounce) can  stewed whole tomatoes, undrained ', '1   tablespoon    balsamic vinegar', '1   tablespoon    fennel seed, briefly crushed ', '3   cups    whole milk ricotta cheese', '1   cup   grated romano cheese or 1   cup    parmesan cheese']",7.7,0,"[0, 0, 0, 0, 0, 0, 0]",0.0,0.0,0.0,0.0,0.0,0.0,0.0,3,0,0,8,5.0,4.0
grilled pork and mushroom skewers,455147,40,28087,2011-05-05,['pork'],5,"['mix together the garlic , salt , pepper , and vinegar', 'marinate the pork cubes in the refrigerator in this mixture for at least 3 hours', 'heat up the grill , and thread on 8 skewers a piece of pork , a few squares of prosciutto , a sage leaf , a few layers of the onion , and a mushroom', 'continue in this manner until all the ingredients are used', 'brush the skewers lightly with the oil , season with additional salt and pepper , and grill until the pork is golden brown , about 10 minutes per side']",these quick and easy skewers combine tender pieces of pork and vegetables marinated in a balsamic sauce. posting for zwt 7. recipe is from http://www.italianfoodforever.com,"['pork', 'garlic clove', 'salt', 'balsamic vinegar', 'olive oil', 'mushrooms', 'onion', 'sage leaves', 'prosciutto']",9,italian,"['1 3/4  lbs    pork tenderloin, cut into 1 1/2 inch cubes ', '1   large    garlic clove, minced ', '  salt & pepper', '2   tablespoons    balsamic vinegar', '1/4  cup    olive oil', '1 (8   ounce) package   mushrooms, cleaned ', '2   large    red onions, quartered ', '24       fresh sage leaves', '1/4  lb   thinly sliced prosciutto, cut into squares ']",1.9,0,"[0, 0, 0, 0, 0, 0, 0]",0.0,0.0,0.0,0.0,0.0,0.0,0.0,3,0,0,1,5.0,5.0
italian ricotta tomato pie,22908,35,27381,2002-03-18,"['eggs-dairy', 'vegetables', 'cheese']",13,"['for crust , stir together baking mix , garlic powder , pepper and hot water until it becomes a dough then knead it with your hands for a few minutes on a floured board', 'press , pat and coax dough out on regular size greased baking sheet', 'set aside', ""slice tomatoes then take the ends and the parts you couldn't get a good slice of and dice them"", 'set aside', 'in a small bowl , mix ricotta with garlic and parmesan', 'carefully spread dough with ricotta mixture , leaving a 1 / 2 inch edge', 'top with mozzarella cheese', 'place tomato slices and then diced tomatoes', 'sprinkle with basil and oregano and then drizzle with oil', 'moisten the edges of the dough with water and fold up to form a small crust', 'bake at 400 for 15 to 20 minutes', 'enjoy !']","an easy-to-make, no-yeast, rustic pizza. uses a pantry staple - bisquick! i adapted this from a recipe off the side of my supermarket's box of all purpose baking mix. it's fast and very yummy.","['baking mix', 'garlic powder', 'black pepper', 'water', 'ricotta cheese', 'garlic', 'parmesan cheese', 'mozzarella cheese', 'tomatoes', 'basil', 'oregano', 'olive oil']",12,italian,"['1 1/2  cups    baking mix (Bisquick)', '1/2  teaspoon    garlic powder', '1/4  teaspoon    black pepper', '1/3  cup    hot water', '1   cup    ricotta cheese', '1   clove   chopped garlic', '1/4  cup    parmesan cheese', '1   cup   shredded mozzarella cheese', '2   medium    tomatoes', '1   teaspoon    dried basil', '1/2  teaspoon    dried oregano', '  olive oil']",1.9,0,"[0, 0, 0, 0, 0, 0, 0]",0.0,0.0,0.0,0.0,0.0,0.0,0.0,3,0,0,1,5.0,4.0
parma figs,135481,20,224740,2005-08-30,"['fruit', 'pork']",4,"['open the figs by scoring them on the top and gently squeeze from the bottom so they ""open up""', 'wrap the ham around the open figs , and spoon some ricotta in to the openings', 'sprinkle the sugar on the ricotta , and place under hot grill until the figs are warm and cheese starts to brown', 'drizzle with honey and serve immediately']","this is a fantastic little starter, the figs look just like little flowers. if you can, use brown sugar and wild honey, the give more rustic taste. original recipe is from conrad gallagher's ""in 3 easy steps"" cookbook.","['parma ham', 'figs', 'ricotta cheese', 'sugar', 'honey']",5,italian,"['8   slices    parma ham', '16 -20       fresh figs', '4   tablespoons    ricotta cheese', '1   tablespoon    brown sugar', '4   tablespoons    honey (preferably wild)']",5.8,0,"[0, 0, 0, 0, 0, 0, 0]",0.0,0.0,0.0,0.0,0.0,0.0,0.0,3,0,0,6,5.0,4.25
linguine with wild mushroom alfredo,34331,40,6258,2002-07-15,"['pasta', 'vegetables']",12,"['cook linguine in 3 qts', 'boiling water until al dente , about 8-10 minutes', 'drain', 'in another large saucepan , heat the oil and wine over medium high heat', 'add mushrooms and garlic , and cook for 6-8 minutes , stirring often', 'stir in the milk , parsley , mustard , thyme , pepper , and salt', 'bring to a gentle simmer over medium heat', 'combine cornstarch and water until smooth', 'stir into the mushroom sauce and return to a gentle simmer', 'fold in the cooked linguine', 'cook for about 1 minute more over low heat , stirring frequently', 'transfer to warm serving plates and serve immediately']","from vegetarian times, here is a new take on the classic alfredo sauce with 3 different kinds of mushrooms which makes a light but appetizing sauce. proof that an appetizing sauce does not have to be a ","['linguine', 'olive oil', 'dry white wine', 'button mushrooms', 'shiitake mushrooms', 'oyster mushrooms', 'garlic', 'milk', 'parsley', 'dijon mustard', 'thyme', 'white pepper', 'salt', 'cornstarch', 'water']",15,italian,"['8   ounces    linguine', '1   tablespoon    olive oil or 1   tablespoon    canola oil', '1   tablespoon    dry white wine', '8   ounces    button mushrooms, sliced ', '6 -8       fresh shiitake mushrooms, sliced ', '4   ounces    oyster mushrooms, sliced ', '3 -4   cloves    garlic, minced ', '2   cups    low-fat milk', '2   tablespoons    fresh parsley, chopped ', '1 1/2  tablespoons    Dijon mustard', '1/2  teaspoon    dried thyme', '1/2  teaspoon    white pepper', '1/2  teaspoon    salt', '2   tablespoons    cornstarch', '2   tablespoons   cold water']",4.1,0,"[0, 0, 0, 0, 0, 0, 0]",0.0,0.0,0.0,0.0,0.0,0.0,0.0,3,0,0,4,5.0,4.33
clam linguine,20575,30,27416,2002-02-24,"['pasta', 'seafood', 'fish']",9,"['in a large frying pan over medium heat , heat olive oil', 'add chopped garlic and saute gently until just golden , about 1 to 2 minutes: do not brown', 'add clams including liquid , cayenne , oregano and lemon juice and simmer for 2 to 3 minutes', 'add chopped parsley and continue to simmer for 1 minute longer', 'cook linguine according to package directions', 'drain and transfer cooked linguine to a large serving bowl', 'pour prepared sauce over pasta and toss to coat', 'sprinkle with grated parmesan cheese and toss lightly', 'serve immediately']",a very easy to make recipe that has a very nice clam taste. i developed this recipe many years ago and it has been enjoyed by all that have tried it.,"['virgin olive oil', 'garlic', 'baby clams', 'cayenne pepper', 'oregano', 'lemon juice', 'parsley', 'linguine', 'parmigiano-reggiano cheese']",9,italian,"['1   tablespoon    extra virgin olive oil', '4   cloves    garlic, finely chopped ', '12   fluid ounces    canned baby clams, include liquid ', '1/8  teaspoon    cayenne pepper', '1/4  teaspoon    dried oregano', '1   tablespoon    lemon juice, freshly squeezed ', '3   tablespoons   finely chopped fresh parsley', '8   ounces    linguine, dry ', '4   tablespoons   grated parmigiano-reggiano cheese']",1.4,0,"[0, 0, 0, 0, 0, 0, 0]",0.0,0.0,0.0,0.0,0.0,0.0,0.0,3,0,0,1,5.0,4.25
simi s pasta al forno,464639,75,866963,2011-09-21,['pasta'],14,"['heat oil in large pan add chicken and brown', 'add garlic and onions and cook until translucent', 'add ham and heat through for 1 or 2 minutes', 'gently mix in artichokes and place the mixture into a bowl', 'pour pasta sauce into pan and add italian seasoning , wine , salt , pepper , and sugar to taste', 'while sauce is simmering cook pasta', 'spray 9x13 pan and heat oven to 375', 'place spinach in colander and drain pasta', 'remove sauce from heat and stir in ricotta , parsley , and basil', 'adjust seasoning if necessary', 'gently mix sauce with chicken and pasta', 'place half of the pasta mixture in 9x13 pan and then sprinkle on half the parmesan , mozzarella , and provolone', 'repeat with remaining pasta and cheese', 'bake for 30 - 45 minutes or until everything is bubbly and cheese is lightly browned']","one of simi's favorite dishes is pasta al forno from nick's, a little italian place by home. she declared this recipe even better. it is gooey with the mozzarella and provolone and healthy with the spinach. this like lasagne or baked ziti can be put together ahead of time and as with most pasta dishes the leftovers are even better. this freezes well in individual portions for a quick meal the kids can ""make"" for themselves.","['olive oil', 'garlic cloves', 'onion', 'pasta sauce', 'chardonnay wine', 'artichoke hearts', 'ham', 'chicken', 'farfalle pasta', 'mozzarella cheese', 'parmesan cheese', 'provolone cheese', 'ricotta cheese', 'parsley', 'italian seasoning', 'basil', 'salt', 'pepper', 'sugar', 'spinach']",20,italian,"['2   tablespoons    olive oil', '4       garlic cloves, minced ', '1/2  cup    onion, chopped ', ""26   ounces    pasta sauce, Hunt's Garlic & Herb "", '1/2  cup    Chardonnay wine', '13 3/4  ounces    canned artichoke hearts, quartered ', '4   ounces    ham, sliced into strips ', '1       boneless chicken breast, cut in 1 inch pieces ', '1   lb    farfalle pasta', '2   cups    mozzarella cheese, shredded ', '1/4  cup    parmesan cheese', '4   ounces    provolone cheese, shredded ', '1   cup    ricotta cheese', '2   tablespoons    fresh parsley, finely chopped ', '  italian seasoning', '  basil, fresh chopped ', '  sea salt', '  pepper', '  sugar (optional)', '2   cups    spinach, chopped  (fresh or frozen)']",9.1,0,"[0, 0, 0, 0, 0, 0, 0]",0.0,0.0,0.0,0.0,0.0,0.0,0.0,3,0,0,9,5.0,5.0
roman stew  crock pot,234848,440,107583,2007-06-14,['beef'],6,"['in a large skillet , brown the beef in the oil over medium-high heat', 'transfer the beef to your slow cooker', 'add the garlic , celery and onion slices to the slow cooker , then sprinkle the salt , cinnamon , cloves , pepper , allspice , and nutmeg over the beef and vegetables', 'pour the tomatoes and the wine over the beef and vegetables', 'cover the slow cooker , and cook on low for 7 to 8 hours', 'if you want a thicker sauce , stir in some cornstarch mixed with water at the end of the cooking time']","based on ancient roman recipe using spices from the far east.  serve this as is with crusty bread, or over steamed rice or mashed potatoes.","['beef', 'olive oil', 'garlic cloves', 'celery', 'onion', 'salt', 'cinnamon', 'cloves', 'pepper', 'allspice', 'nutmeg', 'tomatoes', 'dry red wine']",13,italian,"['3   lbs    beef stew meat, cut into 1-inch cubes ', '3   tablespoons    olive oil', '4       garlic cloves', '2   cups    celery, sliced ', '1   medium    onion, peeled and sliced ', '1   teaspoon    salt', '1 1/4  teaspoons    ground cinnamon', '1/4  teaspoon    ground cloves', '1 1/4  teaspoons    pepper', '1/8  teaspoon    ground allspice', '1/8  teaspoon    ground nutmeg', '14 1/2  ounces    diced tomatoes, undrained ', '1/2  cup    dry red wine']",1.6,0,"[0, 0, 0, 0, 0, 0, 0]",0.0,0.0,0.0,0.0,0.0,0.0,0.0,3,0,0,1,5.0,4.25
thai red pumpkin curry,253915,22,573036,2007-09-19,['vegetables'],7,"['heat wok or deep frying pan over high heat', 'add oil , onions , ginger and curry and cook 1 minute', 'add stock and coconut milk and bring to simmer', 'add the pumpkin , cover and cook for 5 minutes', 'add the eggplants and beans and cook another 5 minutes until the pumpkin is soft', 'stir in basil', 'serve with rice']",adapted from donna hay,"['vegetable oil', 'onion', 'gingerroot', 'thai red curry paste', 'vegetable stock', 'coconut milk', 'pumpkin', 'asparagus', 'pattypan squash', 'thai basil']",10,thai,"['1   tablespoon    vegetable oil', '2       onions, cut in wedges ', '2   teaspoons   grated gingerroot', '1 -2   tablespoon    Thai red curry paste', '1   cup    vegetable stock', '400   ml    coconut milk', '1 1/4  kg    pumpkin, peeled and sliced ', '200   g    asparagus, halved ', '200   g    pattypan squash, halved ', '1/2  cup   fresh Thai basil or 1/2  cup    fresh basil']",3.6,0,"[0, 0, 0, 0, 0, 0, 0]",0.0,0.0,0.0,0.0,0.0,0.0,0.0,3,0,0,3,5.0,4.5
fish potato yellow curry  gaeng leuang pla,257943,30,300807,2007-10-08,"['seafood', 'fish']",11,"['cook potatoes', 'in a large pan bring half the coconut milk to a boil', 'boil , stir occasionally , until it has reduced by halve and the oil separates from the coconut milk', 'now add the curry paste , cook for about 1 minute', 'add remaining coconut milk , stock sauce , juice , , sugar , molasses and maple syrup', 'cook and stir until sugar is dissolve', 'add fish and cooked potatoes to the pan: cook , and stir occasionally', 'remove lemon grass , stir in onion and coriander', 'place curry in a serving bowl', 'sprinkle with sliced chili and coriander leaves', 'enjoy !']",don't be afraid..try this one...all your taste buds will awaken.,"['potatoes', 'coconut milk', 'yellow curry paste', 'fish stock', 'fish sauce', 'lime juice', 'sugar', 'molasses', 'maple syrup', 'white fish fillets', 'onion', 'lemongrass', 'coriander', 'thai chile', 'coriander leaves']",16,thai,"['4       tiny new potatoes, halved ', '2   small    sweet potatoes, cut in 3cm pieces ', '400   ml    coconut milk', '2   tablespoons    yellow curry paste', '60   ml    fish stock or 60   ml    vegetable stock', '2   tablespoons    fish sauce', '1   tablespoon    lime juice', '1   teaspoon    dark brown sugar', '1/2  teaspoon    molasses', '1/2  teaspoon    maple syrup', '800   g   firm white fish fillets, cut into pieces ', '4       green onions, thinly sliced ', '1   stalk    lemongrass (optional)', '1/3  cup    coriander, coarsely chopped ', '1      long red Thai chile, seeded, sliced thinly ', '1   tablespoon    fresh coriander leaves']",5.5,0,"[0, 0, 0, 0, 0, 0, 0]",0.0,0.0,0.0,0.0,0.0,0.0,0.0,3,0,0,6,5.0,5.0
simple thai chicken and noodle soup,472965,35,395634,2012-01-25,['chicken'],9,"['heat the vegetable oil in a large pot over medium-high heat', 'add the onion and cook , stirring occasionally , until softened and lightly browned , about 8 minutes', 'add the garlic and curry paste and cook , stirring , 1 to 2 minutes', 'add the chicken broth , coconut milk and fish sauce', 'cover and bring to a boil', 'add the bell pepper and noodles and simmer , uncovered , until the noodles are al dente , about 3 minutes', 'add the chicken and simmer until just cooked through , about 3 more minutes', 'stir in the lime juice and cilantro', 'add more cilantro and lime juice , if desired , for serving']","i originally found this in foodnetwork magazine.  we've made a few modifications, but it is definitely a keeper!  nearly all the ingredients are easy to keep on hand for when there's a bit of extra chicken that needs dressed up.","['vegetable oil', 'onion', 'garlic cloves', 'green curry paste', 'chicken', 'coconut milk', 'fish sauce', 'red bell pepper', 'udon noodles', 'lime juice', 'cilantro']",12,thai,"['1   tablespoon    vegetable oil', '1   large    onion, thinly sliced ', '2       garlic cloves, minced ', '3   tablespoons    green curry paste (more or less to taste)', '45   ounces    low sodium chicken broth', '1 (15   ounce) can   light coconut milk', '1   tablespoon    fish sauce, plus more to taste ', '1       red bell pepper, thinly sliced ', '5   ounces    udon noodles, broken into pieces ', '1   lb    boneless skinless chicken breast, very thinly sliced crosswise ', '2   tablespoons    fresh lime juice, plus more to taste ', '1   cup    fresh cilantro, roughly chopped ']",3.0,0,"[0, 0, 0, 0, 0, 0, 0]",0.0,0.0,0.0,0.0,0.0,0.0,0.0,3,0,0,3,5.0,5.0
