name,id,minutes,contributor_id,submitted,tags,nutrition,n_steps,steps,description,ingredients,n_ingredients,cuisine,recipeIngredient,fiber,serving_size
bulgogi  korean barbecued beef  lettuce wraps,14339,35,21694,2001-11-15,"['beef', 'fruit', 'vegetables']","[109.0, 8.0, 40.0, 47.0, 6.0, 3.0, 4.0]",11,"['heat a nonstick pan at medium-low for about 30 seconds', 'add sesame seeds and toast , shaking or stirring pan occasionally , until seeds are a nice golden brown , 2 to 3 minutes', 'set aside', 'combine soy sauce , sugar , garlic , green onions , ginger , sesame oil , and toasted sesame seeds', 'stir until the sugar has more or less dissolved', 'add meat , tossing to coat', 'marinate 30 minutes or up to overnight', 'grill meat on a rack over hot coals until beef firms up and slightly charred', 'you want that nice glossy brown look , not the sweaty grayish look', 'serve with lettuce leaves and asian pear slices , allowing guests to roll wraps themselves', 'to assemble , layer a lettuce leaf with a slice or two of grilled beef and a few thin asian pear slices , then roll up and enjoy !']","this dish is great for hot summer days. the crisp lettuce makes a nice wrapper, but doesn't leave you overstuffed like a starchy wrapper can","['round steaks', 'soy sauce', 'sugar', 'garlic', 'onion', 'ginger', 'sesame oil', 'sesame seeds', 'iceberg lettuce', 'asian pears']",10,korean,"['3   large    round steaks or 3   large    sirloin steaks, about 2 pounds total,thinly sliced ', '1/2  cup    soy sauce', '1/4  cup    sugar', '4   cloves    garlic, crushed ', '4       green onions, minced ', '1   inch    fresh ginger, peeled and grated or finely minced ', '2   tablespoons    sesame oil', '2   tablespoons    sesame seeds', '  iceberg lettuce, separated into leaves and kept chilled until serving ', '2       Asian pears, thinly sliced ']",2.0,
kimchi fried rice  kimchi bok eum bap,221939,15,347160,2007-04-11,"['rice', 'pasta']","[1217.6, 87.0, 3.0, 14.0, 29.0, 37.0, 52.0]",8,"['heat oil in wok or good-sized frying pan', 'add kim chi and garlic', 'stir-fry until kim chi is translucent', 'be careful: it will really spatter when it hits the oil !', 'add rice , green onions , fish cake or meat , mushrooms', 'stir-fry until well mixed and heated through', 'remove from heat', 'add in sesame seeds , soy sauce , salt and pepper to taste']","the name says it all.  a great way to use up left over rice.  don't feel limited to the listed ingredients; mushrooms, a bit of meat, a scrambled egg etc... are all great in this dish.  this recipe makes one really generous serving or two side dish servings.  multiplies easily.","['vegetable oil', 'kim chee', 'garlic clove', 'rice', 'onion', 'fish cake', 'sesame seeds', 'soy sauce', 'salt']",9,korean,"['4   tablespoons    vegetable oil (part sesame gives a good flavour)', '1/2  cup    kim chee, cut small and squeezed or drained ', '1       garlic clove, minced ', '1   cup   prepared rice (preferably Korean or Japanese)', '2       green onions, sliced on bias ', '1   sheet   korean fish cake, cut in bite-size pieces ', '1   teaspoon    sesame seeds', '1   teaspoon    soy sauce', '  salt and pepper, to taste ']",4.0,
bulgoki,17381,1455,29110,2002-01-18,"['beef', 'pork']","[2648.2, 354.0, 223.0, 338.0, 117.0, 383.0, 33.0]",4,"['mix all the above ingredients in a shallow dish and refrigerate over night', 'remove meat from the marinade', 'barbeque or pan fry', 'serve with rice , stir fried vegetables , and kimche']",this marinade originated in korea. it is sweet and salty. very satisfying and even people who won't eat take out will eat it if you call it something like 'hot jerky' or what ever.,"['vegetable oil', 'soy sauce', 'sugar', 'sesame seeds', 'vinegar', 'beef', 'garlic', 'scallion', 'red pepper']",9,korean,"['1/2  cup    vegetable oil or 1/2  cup    sesame oil', '2   cups    soy sauce', '1   cup    brown sugar', '2 1/2  cups    toasted sesame seeds', '2   tablespoons    vinegar (apple cider or rice wine is best)', '2   lbs    beef, cut into strips  (think beef jerky) or 2   lbs    pork', '1   tablespoon   minced garlic', ' minced scallion', '  crushed red pepper flakes (optional)']",21.5,
grilled shrimp with korean sesame marinade,45490,20,10033,2002-11-05,"['seafood', 'shrimp', 'fish']","[340.6, 13.0, 88.0, 258.0, 70.0, 6.0, 10.0]",6,"['combine all ingredients in a small bowl until well blended', 'marinade shrimp for 1 hour in the refrigerator', 'thread shrimp and green onion strips on metal or bamboo skewers , alternating', 'grill , turning once , basting 5 minutes until tender', 'boil remaining marinade in saucepan for 1 minute', 'serve with shrimp']",my old time favorite. quick and easy,"['shrimp', 'onion', 'soy sauce', 'sugar', 'sesame oil', 'maple syrup', 'garlic', 'ginger', 'black pepper']",11,korean,"['1   lb   unshelled large shrimp', '1   bunch    green onion, cut into strips ', '1 1/2  cups    soy sauce', '1/4  cup   packed brown sugar', '2   tablespoons   dark sesame oil', '1   tablespoon    maple syrup', '1   tablespoon    granulated sugar', '5   cloves    garlic, finely chopped ', '3   tablespoons   sliced green onions', '2   teaspoons   grated fresh ginger or 1/2  teaspoon    ground ginger', '1/2  teaspoon    cracked black pepper']",1.9,
ho dduk  korean pancakes,89731,90,22015,2004-04-22,['pasta'],"[149.9, 6.0, 33.0, 7.0, 6.0, 11.0, 8.0]",20,"['mix yeast , 2 tbsp sugar and warm water together in a bowl', 'mix potato flakes with cold water in a separate bowl', 'in your mixer combine the powdered milk , 1 / 4 sugar , salt and 4 c flour', 'add softened butter , eggs , yeast and potato mixtures to mixer bowl', 'mix until well blended', 'add remaining flour in small amounts until it""cleans"" the sides of the mixing bowl', 'remove from bowl and knead on a floured board for about 10 minutes', 'grease a clean bowl and set the dough inside to rise for about 45 minutes', 'divide into 36 balls and cover with a damp cloth', 'mix brown sugar and cinnamon together', 'add more cinnamon if you prefer', 'add enough oil to the bottom of a skillet to just barely cover the bottom', 'heat over a medium flame', 'take a ball of dough and flatten in the palm of your hand', 'put a spoonful of the cinnamon mixture on the dough and wrap the dough around it', 'put into the hot oil and let cook about a half of a minute then flatten with a spatula', 'let cook another 30 seconds , flip and flatten some more', 'allow it to finish browning', 'remove from skillet and let cool on a paper towel', 'repeat the process adding more oil as needed to the skillet to prevent the pancakes from sticking']",these were described to me as inside out pancakes. i just call them delicious.,"['butter', 'eggs', 'yeast', 'sugar', 'water', 'potato flakes', 'powdered milk', 'salt', 'flour', 'cinnamon', 'vegetable oil']",13,korean,"['10   tablespoons    butter or 10   tablespoons    margarine, softened ', '2       eggs, beaten ', '2   tablespoons    yeast', '2   tablespoons    sugar', '1 1/2  cups    warm water', '1/2  cup    potato flakes', '1   cup    cold water', '1/4  cup    powdered milk', '1/4  cup    sugar', '2   teaspoons    salt', '6   cups    flour', '1   cup    brown sugar', '2   tablespoons    cinnamon', '  vegetable oil']",1.0,
korean chicken soup,374932,210,232669,2009-05-29,"['pasta', 'vegetables', 'chicken']","[753.3, 64.0, 17.0, 58.0, 105.0, 54.0, 13.0]",18,"['in a stockpot , combine the chicken and neck with the water , onion , carrots , celery , garlic , peppercorns , bay leaf , parsley springs and thyme sprigs and bring to a boil', 'cover partially and simmer over low heat for 30 minutes', 'transfer the chicken to a plate', 'discard the skin', 'pull the meat off the bones , cut it into 1 / 2-inch pieces and refrigerate', 'return the bones to the pot , partially cover and simmer for 1 hour , until the broth is richly flavored', 'strain the broth into a clean heat proof bowl and rinse out the pot', 'return the broth to the pot and boil over moderate heat until reduced to 8 cups , about 30 minutes', 'season with salt & freshly ground black pepper', 'in a medium saucepan of boiling salted water , cook the udon until al dente', 'drain and cool under running water', 'drain again', 'in a large skillet , heat the vegetable oil', 'add the mushrooms and cook over high heat , stirring , until golden , about 7 minutes', 'scrape the mushrooms into the stockpot and add the udon , ginger , tofu , kimchee , fish sauce and sesame oil', 'season with salt and simmer for 5 minutes', 'add the chicken and simmer until just heated through', 'ladle into bowls , serve & enjoy !']","food & wine magazine, december 2008 edition - perfecting chicken soup, recipe by grace parisi. it is a deeply flavorful broth and we enjoyed it ever so much :) and have even put it on the menu at our cafe ponce. we serve this with a salad, homemade bread or some sort of biscuits (i know) but the residents' like biscuits and we use different recipes to see which they prefer. we also had to make a few changes with the soup but that is when we are making it for the whole home, as we have chicken soup twice a day! when we make it for the cafe - it is the real thing. it also works on colds like jewish penicillin ;)","['chicken', 'water', 'onion', 'carrots', 'celery ribs', 'garlic clove', 'black pepper', 'bay leaf', 'parsley sprigs', 'thyme sprigs', 'salt', 'udon noodles', 'vegetable oil', 'shiitake mushroom', 'ginger', 'firm silken tofu', 'cabbage', 'fish sauce', 'sesame oil']",19,korean,"['3   lbs    chicken, neck reserved ', '3 1/2  quarts    water', '1   medium   unpeeled onion, quartered ', '2       carrots, scrubbed and cut into 2-inch pieces ', '2       celery ribs, cut into 2-inch pieces ', '1   large   unpeeled garlic clove, smashed ', '1   teaspoon    whole black peppercorn', '3 1/2  quarts    water', '1   large    fresh bay leaf', '6       parsley sprigs', '2       fresh thyme sprigs', '  kosher salt', '8   ounces   thick udon noodles', '2   tablespoons    vegetable oil', '1/2  lb    shiitake mushroom, thinly sliced ', '1/4  cup   finely julienne peeled ginger', '12   ounces   block firm silken tofu, cut into 1/2-inch cubes ', '1   cup   kimchee cabbage, thinly sliced ', '2   tablespoons   asian fish sauce', '1   teaspoon    sesame oil']",4.6,
barbecued beef  pulgogi,439480,25,283251,2010-10-14,[],"[478.8, 45.0, 27.0, 45.0, 77.0, 45.0, 4.0]",7,"['in a large bowl , combine the soy sauce , sesame oil , sugar , black pepper , garlic , green onions and sesame seeds', 'slice beef thinly into x 2 inch pieces', 'add meat to soy sauce mixture and mix well', 'cover and refrigerate 1-2 hours', 'preheat oven to broil', 'broil on broiler rack or grill meat for 2-3 minutes per side or until brown', 'serve with vegetable side dishes and rice']",cooking the korean way,"['soy sauce', 'sesame oil', 'sugar', 'black pepper', 'garlic', 'onion', 'sesame seeds', 'beef']",8,korean,"['4   tablespoons    soy sauce', '2   tablespoons    sesame oil', '2   tablespoons    sugar', '1/2  teaspoon    black pepper', '1      clove garlic, finely chopped ', '4   tablespoons   finely chopped green onions', '1   tablespoon    toasted sesame seeds', '1 1/2  lbs    beef sirloin tip']",1.2,
pan seared flat iron steak with spicy minted drizzle,261279,30,625570,2007-10-25,"['salads', 'beef']","[363.6, 40.0, 17.0, 61.0, 46.0, 33.0, 2.0]",11,"['create the drizzle by combining all ingredients , except steak , peppers , scallions and lettuce', 'place ingredients into a food processor and pulse for about 30-45 seconds to create a thin ""drizzle""', 'rub 1 / 3 of mixture on steak and allow to sit for approximately 20-30 minutes', 'heat heavy duty saute pan or cast iron pan just to smoking point', 'add 1t olive oil for searing', 'sear marinated steak for 3-4 minutes on each side', 'do not over cook this cut of meat', 'best served mr to rare', 'remove from pan and allow to rest on cutting board', 'slice thin and serve in a lettuce leaf with peppers , scallion and drizzle', 'roll lettuce and enjoy']","these amazing flavors will make your taste buds dance.  
a well balanced lunch.","['flat iron steaks', 'red pepper', 'onion', 'lettuce leaf', 'olive oil', 'mint leaves', 'kikkoman soy sauce', 'jalapeno pepper', 'garlic', 'salt', 'black pepper', 'rice vinegar', 'sugar']",13,korean,"['8   ounces    flat iron steaks', '2   ounces    red peppers, julienne ', '2   ounces    green onions, julienne ', '1   ounce   boston bib lettuce leaf', '2   tablespoons    olive oil', '2   tablespoons    fresh mint leaves', '1   tablespoon    Kikkoman soy sauce', '1   teaspoon    jalapeno pepper, minced ', '1   teaspoon    garlic, minced ', '1   teaspoon    kosher salt', '1/2  teaspoon    black pepper', '1   teaspoon    rice vinegar', '1   teaspoon    brown sugar']",1.9,
grandma s rainy day kimchi noodle soup,402890,45,1473376,2009-12-08,"['vegetables', 'pasta']","[685.6, 33.0, 16.0, 35.0, 70.0, 20.0, 29.0]",16,"['in a large pot add vegetable oil and garlic and saut until soft', 'add pork and cook until it is slightly browned', 'season with salt , pepper and rice wine vinegar and stir for 2 minutes', 'add kimchi and saut for 3 minutes', 'add the water , soy sauce , dashida , and ginger', 'stir and simmer on low heat for about 15 minutes', 'add the mushrooms and tofu and turn up the heat to medium', 'cook for 3 minutes', 'carefully add the egg noodles , bok choy and just enough water to cover all of the ingredients', 'stir gently and scrape the bottom of the pot to make sure the noodles are not sticking', 'season with salt and pepper', 'simmer for 3 minutes', 'putting it all together', 'equally divide the soup in four large bowls', 'drizzle the sesame seed oil and top with scallions', 'for that extra kick and flavor , add sriracha sauce']","this is a variation of another dish my grandmother made when she stayed with us. dont let the number of ingredients freak you out. theyre mostly seasoning and spices and not a lot of chopping, mincing, or dicing. 

bok choy and shitake mushrooms are two of my favorite vegetables and i added these two items to the recipe. i also switched out the anchovies broth for water and added dashida, which is a soup stock that comes in anchovy, clam or beef flavors. i use beef dashida.","['chinese egg noodles', 'vegetable oil', 'garlic cloves', 'pork', 'rice wine vinegar', 'water', 'soy sauce', 'dashida', 'ginger', 'cabbage', 'shiitake mushrooms', 'firm tofu', 'baby bok choy', 'scallions', 'dark sesame oil', 'salt', 'sriracha sauce']",17,korean,"['16   ounces   of fresh Chinese egg noodles (Lo mein noodles)', '3   tablespoons    vegetable oil', '6       garlic cloves, minced ', '8   ounces    pork tenderloin, thinly sliced ', '2   teaspoons    rice wine vinegar', '6 -8   cups    water', '3   tablespoons    soy sauce', '2   tablespoons    dashida, powder  (Beef flavored soup stock)', '2   teaspoons    ginger, grated ', '2   cups    cabbage kimchi, chopped in big pieces ', '4   ounces    shiitake mushrooms, thinly sliced ', '7   ounces    firm tofu, cut into 1-inch squares ', '4       baby bok choy, quartered ', '2       scallions, thinly sliced ', '2   teaspoons    dark sesame oil', '  salt and pepper (Add a little salt and pepper at a time and taste as you go. The kimchi and soy sauce may be enough s)', '  sriracha sauce (Optional but highly recommended.)']",5.8,
galbi  kalbi  grilled korean short ribs  flanken cut,417662,25,294255,2010-03-23,['beef'],"[1146.5, 142.0, 132.0, 90.0, 74.0, 186.0, 12.0]",8,"['place the ribs in a dish for marinating', 'mix the remaining ingredients in a bowl , being sure to add the coke last , as it will foam up a bit when added to the other ingredients', 'pour the marinade over the beef and massage it in for about one minute', 'cover and let marinate for at least 4 hours turning at least once', 'heat gas or charcoal grill to medium hot', 'remove the ribs from the marinade and place on the hot grill', 'grill the ribs , turning once , to desired doneness , about 3 to 4 minutes per side', 'serve with rice and a variety of korean side dishes such as kimchi , namul and musangchae for a delicious korean meal']","this is my favorite recipe for ribs. korean-style short ribs are cut lengthwise across the rib bones, this is also known as flanken. the result is a thin strip of meat, about 8 to10 inches in length. the thin slices make for fast cooking on the grill, which makes them great to cook for company. we serve them with rice and various korean side dishes. this recipe differs from the others posted on recipezaar as they are missing one crucial ingredient used by the korean woman that taught this recipe to my husband. the ingredient is coca cola. sounds strange, but it works wonderfully and helps to keep the meat tender and juicy. prep time does not include the marinating time. the longer you marinate these ribs, the better they come out.","['beef', 'soy sauce', 'sugar', 'sesame oil', 'garlic', 'rice wine', 'black pepper', 'onion', 'coca-cola']",9,korean,"['2   lbs    beef short ribs (flanken cut)', '1/2  cup    light soy sauce', '1/2  cup    brown sugar', '3   tablespoons    sesame oil', '3   tablespoons    garlic (finely chopped)', '3   tablespoons    rice wine (or Soju)', '1/2  teaspoon    ground black pepper', '2       green onions (finely chopped)', '1   cup    Coca-Cola']",0.7,
cinnamon tea  korea,423601,27,424680,2010-05-06,[],"[101.5, 0.0, 99.0, 0.0, 0.0, 0.0, 8.0]",4,"['in a saucepan , combine cinnamon , water & sugar', 'bring to a boil , then turn heat to low & simmer for 20 minutes , before setting aside to cool', 'after tea has cooled , chill it in the refrigerator', 'to serve , remove cinnamon sticks & pour the cold tea into cups or glasses , then garnish with pine nuts']","this recipe was found in the 2005 cookbook, the best recipes in the world. preparation time does not include the time needed for the tea to chill.","['cinnamon sticks', 'water', 'sugar', 'pine nuts']",4,korean,"['5       cinnamon sticks', '1   quart    water', '1/2  cup    granulated sugar (or to taste)', '1   teaspoon    pine nuts, lightly toasted ']",0.0,
pajeon  korean scallion and seafood pancake,167120,30,299800,2006-05-08,"['seafood', 'vegetables']","[661.5, 41.0, 13.0, 62.0, 47.0, 20.0, 26.0]",11,"['trim the small green onions and scallions and cut them into 4-inch lengths', 'wash oysters , clams , and hard-shelled mussels in brine and drain on a wicker tray', 'slice oysters , clams , and hard-shelled mussels', 'beat ""a"" with a whisk into a light batter and mix half the chopped seafood in the batter', '""a"" can be bought pre-mixed in bags in korean food stores', 'place the green onions and scallions parallel in an oiled pan at a low heat and ladle a scoop of the batter onto them', 'after the patty cooks slightly , sprinkle the sea food and spread a little bit of batter again on the top', 'turn the patty and fry until each side becomes appetizingly yellowish brown', 'serve the pan-fried green onion and sea food with vinegar soy sauce mixed with ""b""', 'you can make this recipe with chives instead of green onions , and omitting the seafood if you like', 'try putting your favourite veggies in there']","this is a favourite korean appetizer. it's any time of day (breakfast or lunch), and often eaten with maccoli (homestyle rice wine) on rainy days with friends in korean pubs.","['onion', 'scallions', 'clam', 'oyster', 'mussels', 'vegetable oil', 'flour', 'egg', 'water', 'soy sauce', 'vinegar', 'red pepper', 'garlic', 'sesame seeds', 'sesame oil', 'sugar']",18,korean,"['100   g   of small green onions', '50   g    scallions', '1/3  cup    clam', '1/2  cup    oyster', '1/2  cup   of hard-shelled mussels', '4   tablespoons    vegetable oil', '1 1/2  cups    flour', '1/2  cup    rice flour', '1       egg', '2   cups    water', '4   tablespoons    soy sauce', '2   tablespoons    vinegar', '2   teaspoons    red pepper powder', '1   tablespoon   of finely chopped green onion', '1/2  tablespoon   of minced garlic', '2   teaspoons    sesame seeds', '2   teaspoons    sesame oil', '1   teaspoon    sugar']",4.5,
korean pan grilled chicken,80773,35,1533,2004-01-11,"['vegetables', 'chicken']","[434.0, 39.0, 37.0, 45.0, 55.0, 25.0, 4.0]",14,"['combine the soy sauce , sugar , garlic , ginger , spring onions , sesame seeds , black pepper , sesame oil and dry sherry in a bowl and mix well', 'cut the chicken breasts at an angle crossways to get wide 1 / 8"" thick slices', 'use a meat pounder to flatten the slices a little more', 'put in a flat layer on the bottom of a shallow bowl', 'cover the pieces with some of the sauce', 'do all the chicken pieces in this way and set aside for at least an hour', 'when ready to eat heat oil in a wide non-stick frying pan over a high heat', 'when the oil is hot put in the chicken in a single layer , laying them out flat', 'reserve the marinade', 'cook for about a minute on each side until lightly browned', 'remove and keep warm', 'put the mushrooms and chillies into the frying pan and pour over the marinade', 'stir and cook for one minute', 'pour over the chicken and serve immediately with rice or noodles']","this has a great flavor, i added more mushrooms, but you decide.","['dark soy sauce', 'sugar', 'garlic cloves', 'ginger', 'onion', 'sesame seeds', 'black pepper', 'sesame oil', 'dry sherry', 'chicken', 'vegetable oil', 'mushrooms', 'hot green chili peppers']",13,korean,"['3   tablespoons   japanese dark soy sauce', '1 1/2  tablespoons    sugar', '2       garlic cloves, peeled & crushed ', '1   inch    ginger, peeled & grated ', '2       spring onions, cut in thin rounds ', '1   tablespoon   roasted & lightly crushed sesame seeds', '  fresh ground black pepper', '2   tablespoons    sesame oil', '2   tablespoons    dry sherry or 2   tablespoons    sake', '12   ounces   boned free range chicken breasts', '1   tablespoon    vegetable oil', '4   large    mushrooms, thickly sliced ', '2      fresh hot green chili peppers, deseeded & cut in 1/2 inch segments ']",1.6,
chinese baked sweet bread dough,129368,38,225426,2005-07-11,"['breads', 'eggs-dairy', 'pasta']","[172.5, 14.0, 7.0, 0.0, 6.0, 7.0, 6.0]",40,"['put the yeast and 1 tablespoon of the sugar in a small bowl', 'add 1 / 4 cup of the warm milk', 'let stand 5 minutes , then stir to dissolve', 'it should foam and bubble', 'if it does not , discard and use a fresh package of yeast', 'stir in the egg , oil and remaining milk', 'put the flour and remaining sugar in the work bowl of a food processor fitted with the metal blade', 'process 2 seconds', 'with the machine running , pour the warm milk mixture down the feed tube in a steady stream', 'process until it forms a rough ball', 'if ball is sticky and wet , add a little more flour', 'process a few seconds longer , or until dough pulls away from the sides of the bowl', 'remove dough to a lightly floured board', 'knead dough , dusting with flour to keep it from sticking , until smooth and elastic , about 2 minutes', 'place in a large oiled bowl , cover with plastic wrap and let rise in a warm spot until doubled , about 1 hour', 'punch down dough and place on a lightly floured surface', 'it is now ready to form into rolls , buns or loaves', 'if preparing filled buns: cut dough in half', 'form each half into a 12-inch long log', 'cut into 10 pieces', 'roll each piece into a 4-inch circle', 'roll outer inch of each circle 1 / 8-inch thin', 'leave middle slightly thicker', 'if right-handed , place a dough circle in palm of your left hand', 'put a big tablespoon of filling in the', 'middle', 'put left thumb over the filling', 'with your right hand , bring up edge and make a pleat in it', 'rotate circle a little and make a second pleat', 'as you make each pleat , gently pull it up and around as if to enclose your thumb', 'continue rotating , pleating and pinching , then gently twist into a spiral', 'pinch to seal', 'place bun pleated side down on a parchment square', 'repeat with remaining dough and filling', 'put buns 1 1 / 2 inches apart on a baking sheet', 'let rise until doubled in size , 30 minutes to 1 hour', 'preheat oven to 350 degrees f', 'beat egg yolks with water and sugar', 'brush over buns', 'bake 20 minutes']","chinese bread dough is quite sweet compared with western breads (the further south you go in china, the sweeter the dough becomes). most chinese breads are steamed, which is why they look pale and uncooked to the western eye.
this can be made plain or used for chinese buns (bao).  the buns can be filled with a variety of fillings, such as custard, mung bean paste, or bbqed meat.  be creative!","['yeast', 'sugar', 'milk', 'egg', 'vegetable oil', 'flour']",6,korean,"['1   tablespoon    active dry yeast (1 package)', '3   tablespoons    sugar', '1   cup   warm milk (about 100 to 110 degrees F)', '1       egg', '3/4  cup    vegetable oil', '3 1/2  cups    all-purpose flour, and more for dusting and kneading ']",0.7,
