name,id,minutes,contributor_id,submitted,tags,nutrition,n_steps,steps,description,ingredients,n_ingredients,cuisine,recipeIngredient,fiber,serving_size
shawarma,10392,735,10404,2001-07-24,"['beef', 'lamb-sheep']","[1125.2, 148.0, 9.0, 22.0, 42.0, 181.0, 14.0]",8,"['combine yogurt , lemon juice , garlic , pepper sauce , vinegar , onion , black and cayenne pepper , mace , and salt', 'add meat and marinate overnight', 'grill the meat until done or broil in oven', 'combine the tahini , garlic , lemon juice , and parsley', 'whisk well', 'add water if needed', 'to make the sandwich slice open a pita , spread some tahini sauce on the bread and add some lettuce and sprouts , tomato , onion and meat', 'pour on a little tzatziki and chow down']",a very tasty grilled meat sandwich.,"['plain yogurt', 'lemon juice', 'garlic', 'hot pepper sauce', 'vinegar', 'onion', 'black pepper', 'cayenne pepper', 'mace', 'salt', 'beef', 'tahini', 'parsley', 'water', 'pita bread', 'tomatoes', 'sprouts', 'lettuce', 'tzatziki']",19,indian,"['1   cup    plain yogurt', '2   teaspoons    lemon juice', '4   cloves    garlic, minced ', '1/2  teaspoon    hot pepper sauce', '1   teaspoon    vinegar', '1   teaspoon    onion, finely minced ', '1/2  teaspoon    black pepper', '1/2  teaspoon    cayenne pepper', '1/2  teaspoon    ground mace', '1/2  teaspoon    salt', '2   lbs    chicken or 2   lbs    lamb, sliced very thin ', '1   cup    tahini', '2   cloves    garlic, minced ', '2   teaspoons    lemon juice', '2   teaspoons   chopped parsley', '1/2  cup    water', '8   slices    pita bread', ' sliced tomatoes', ' sliced onion', '  mixed sprouts', '  lettuce, sliced thin ', '  tzatziki']",4.3, 1 (256) g
spicy yam curry,304057,45,37636,2008-05-18,['vegetables'],"[321.2, 15.0, 35.0, 30.0, 10.0, 6.0, 18.0]",8,"['heat mustard oil or ghee in a large saucepan and add cumin seed', 'cook 30 seconds or until fragrant , but do not burn', 'add chopped onion , garlic , and cayenne pepper , cooking for several minutes or until onions begin to soften', 'stir in diced yam , diced tomatoes , salt , and curry powder', 'mix tamarind paste with warm water and add to pan', 'reduce heat , cover and simmer for 20-25 minutes , stirring occasionally , or until yam is tender , adding water if necessary to keep from sticking', 'stir in thawed peas and cook for 1-2 minutes more , or until peas are tender', 'serve garnished with chopped cilantro , with freshly steamed basmati rice']","the yam in this (suran), is related to the sweet potato. however, that being said, do not look for a marshmallow topped, brown sugar filled concoction. this is definitely all curry, and is a bit spicy as well. eat as a vegetarian main dish, or as a side dish to other recipes. if you cannot find suran, just substitute sweet potato or white potatoes. i am sure they would work well.","['mustard oil', 'cumin seed', 'onion', 'garlic cloves', 'cayenne pepper', 'yams', 'tomatoes with juice', 'salt', 'mild curry powder', 'tamarind paste', 'water', 'peas', 'cilantro']",13,indian,"['2   tablespoons    mustard oil or 2   tablespoons    ghee', '1   teaspoon    cumin seed', '1       onion, chopped ', '3       garlic cloves, minced ', '1/2  teaspoon    cayenne pepper (add as much as you want)', '14   ounces   suran yams, cut into cubes ', '14 1/2  ounces    diced tomatoes with juice', '1/2  teaspoon    salt', '1 -2   tablespoon    mild curry powder (to taste)', '1/2  teaspoon    tamarind paste', '1/2  cup    warm water', '1/2  cup    frozen peas, thawed ', '2   tablespoons   chopped cilantro (coriander leaf)']",9.5, 1 (288) g
vegan chickpea korma,271664,55,613457,2007-12-13,['beans'],"[499.7, 35.0, 174.0, 14.0, 13.0, 68.0, 23.0]",9,"['combine the tomato paste , garlic , curry powder , cardamom , coriander , and a bit of the vegetable oil to make a paste', 'set aside', 'fry the chopped onion in vegetable oil until soft', 'stir curry paste mixture into the onion and fry together for a minute', 'stir the coconut milk into the onion / curry paste mixture in the pan to create the sauce and heat through to bubbling', 'add in the bell pepper and chickpeas', 'stir together , and then stir in ginger and cayenne pepper', 'bring to bubbling and then cover and reduce heat', 'simmer for 15 minutes']",you can serve this over rice or as is.,"['chickpeas', 'coconut milk', 'onion', 'red bell pepper', 'vegetable oil', 'tomato paste', 'garlic clove', 'ginger', 'curry powder', 'cardamom', 'coriander', 'cayenne pepper']",12,indian,"['15 1/2  ounces    chickpeas (I use low sodium)', '13 1/2  ounces    coconut milk', '1   medium    onion, chopped small ', '1   small    red bell pepper, coarsely chopped ', '3   tablespoons    vegetable oil', '2   tablespoons    tomato paste', '1       garlic clove, minced ', '1   tablespoon    ginger', '3   tablespoons    curry powder', '1   teaspoon    ground cardamom', '1   teaspoon    ground coriander', '  cayenne pepper']",6.7, 1 (222) g
pork biryani,353160,135,384210,2009-01-31,"['pork', 'rice', 'pasta']","[1075.9, 92.0, 29.0, 26.0, 87.0, 105.0, 31.0]",20,"['mix the pork in a bowl with the ginger , garlic , garam masala , chili powder , tumeric , chillies , mint and coriander', 'cover and refrigerate overnight', 'the next day , put the sliced onion in a colander , sprinkle with salt to draw liquid out of the onions', 'discard liquid , rinse onions and pat dry', 'heat oil and butter in a dutch oven , then fry onions until golden brown', 'remove onions and drain', 'pour off and reserve all but about 2 tbsp of the butter and oil', 'fry the pork in the dutch oven until well browned', 'add cooked onions and yogurt and cook on low for 40 minutes', 'in a large saucepan , boil enough water to cover rice', 'add rice , return to the boil , and cook 5 minutes', 'drain rice , spread on top of onions and pork in dutch oven', 'drizzle with lemon juice , saffron / milk mixture , and the leftover butter and oil', 'preheat the oven to 425 fahrenheit', 'make a dough by adding a little water to the flour and 1 tsp salt', 'roll dough into a long , thin sausage shape , and press along the top rim of the dutch oven', 'when the lid is placed on this dough , it will form a seal between the lid and base of the dutch oven', 'cook sealed dutch oven on high heat for 5 minutes before transferring to oven', 'bake in oven for 40 minutes', 'remove from oven , break dough seal and enjoy']","adapted from a recipe in the essential rice cookbook. nice flavor, good indian food for people who don't like curry (although i don't know why one would dislike curry). meat was extremely tender and juicy. ps: if you're one of those like me who doesn't like to measure, go easy on the lemon juice so that you don't overpower the saffron.","['pork', 'gingerroot', 'garlic cloves', 'garam masala', 'chili powder', 'turmeric', 'green chilies', 'mint', 'coriander', 'basmati rice', 'onion', 'salt', 'oil', 'butter', 'plain yogurt', 'saffron thread', 'milk', 'lemon juice', 'flour']",19,indian,"['2   lbs    pork loin, cut into 1 inch cubes ', '3   inches   piece gingerroot, grated ', '2       garlic cloves, crushed ', '2   tablespoons    garam masala (an Indian spice, you can probably find it with the spices at the store)', '1/2  teaspoon    chili powder', '1/2  teaspoon    ground turmeric', '4       green chilies, finely chopped ', '3   tablespoons   chopped mint', '4   tablespoons    ground coriander', '2 1/2  cups    basmati rice', '4       onions, thinly sliced ', '  salt', '1/2  cup    oil', '4   ounces    butter, melted ', '8   ounces    plain yogurt', '1/2  teaspoon    saffron thread, soaked in ', '2   tablespoons   hot milk', '1   tablespoon    lemon juice', '1 1/3  cups    whole wheat flour (barley, wheat, etc)', '1   teaspoon    salt']",9.1, 1 (468) g
chaat masala by anupy singla,485122,9,860079,2012-08-09,[],"[180.1, 10.0, 38.0, 292.0, 15.0, 2.0, 11.0]",12,"['toast:', 'dry roast the coriander , cumin and fennel seeds , plus the dried red chilies , in a shallow heavy skillet over medium heat', 'stir every 15-20 seconds to prevent burning', 'the spices should be just toasted and aromatic', 'after about 4 minutes of roasting , transfer the mixture to a plate', 'let cool 15 minutes', 'grind:', 'transfer spices to a spice grinder or the dry jug of a powerful blender', 'add whole black peppercorns , mango powder , black salt , ground ginger and carom seeds', 'process to a fine powder', 'sift after grinding to get a finer powder', 'store in an airtight container up to 6 months']","found this in our local newspaper, the orlando sentinel july 25, 2012 - they ran a special section on vegan indian cooking. in ""vegan indian cooking"" by anupy singla, she suggests ""try this on raw veggies, sprinkled over boiled potatoes or stir a pinch into your plain soy yogurt."" look for the mango powder, black salt and carom seeds in indian groceries or spice shops.","['coriander seed', 'cumin seeds', 'fennel seeds', 'red chilies', 'black pepper', 'mango powder', 'salt', 'ginger', 'carom seeds']",9,indian,"['1/2  cup   heaping coriander seed', '2   tablespoons   heaping cumin seeds', '2   tablespoons   heaping fennel seeds', '8      whole dried red chilies, broken into pieces ', '1/2  cup    whole black peppercorn', '2   teaspoons   heaping mango powder (amchur)', '2   tablespoons    black salt', '2   teaspoons   heaping ground ginger', '2   teaspoons   heaping carom seeds']",14.3, 1 (1264) g
cold coffee,237698,2,427743,2007-06-28,[],"[209.3, 13.0, 50.0, 5.0, 16.0, 27.0, 8.0]",2,"['place all the ingredients in a blender and process till well blended', 'pour in two glasses and serve']",another superb chiller from ndtv.,"['milk', 'instant coffee powder', 'sugar', 'ice', 'cream']",5,indian,"['2   cups   chilled milk', '4   teaspoons    instant coffee powder', '2   tablespoons    sugar', '1/2  cup   crushed ice', '1/4  cup    cream (optional)']",0.0, 1 (347) g
yogurt cheese with hot nut topping,174349,20,37449,2006-06-21,"['eggs-dairy', 'fruit']","[453.1, 39.0, 156.0, 14.0, 29.0, 37.0, 15.0]",11,"['pour the yogurt into a cheesecloth lined coolander over a bowl', 'cover and leave it overnight at room temperature', 'the next day , discard the liquid whey(save to use in a smoothie or add to bread when making , and place the yogurt ""cheese"" in a bowl', 'add the honey , cardamom , nutmeg and cinnamon', 'mix well', 'chill the cheese spice mixture in the refrigerator', 'just before serving , heat the 2 tbls', 'honey gently in a saucepan and stir in the nuts', 'heat on low heat for 2-3 minutes , until the nuts are hot and well coated', 'spoon the cheese mixture into serving bowls , pour the nut sauce over and serve immediately', 'enjoy !']","exotic and delicious! this dessert is made in india and africa! this is good on it's own, but served with fruit, it's great!","['plain yogurt', 'honey', 'cardamom', 'nutmeg', 'cinnamon', 'nuts']",6,indian,"['4   cups    plain yogurt', '1/4  cup    honey', '1   teaspoon    ground cardamom', '1/2  teaspoon    nutmeg', '1/2  teaspoon    cinnamon', '2   tablespoons    honey', '1   cup    mixed nuts (peanuts, almonds, walnuts, etc.)']",3.5, 1 (312) g
creamy curry sauce,161679,60,203029,2006-03-27,[],"[326.5, 35.0, 90.0, 27.0, 10.0, 43.0, 9.0]",7,"['gently heat sunflower oil in a large pan', 'add onion and stir over high heat for 5 minutes until soft', 'add ginger and garlic , stir for 30 secs , then reduce heat and simmer for 5 minutes', 'add tomato paste , cream , coconut milk and milk', 'bring to boil , stirring continually , then cover and simmer for 15 minutes', 'add spices , salt and sugar , stir them in well and then simmer for a further 15 minutes', 'remove from heat , allow to cool slightly then liquidize in a blender']",this is a blend of about 6 different curry recipes! to reduce the fat content i use sunflower oil instead of the traditional ghee and milk rather than table cream but the sauce still has a wonderfully creamy texture. my family love it with seafood or chicken and vegetables and it freezes well too.,"['onion', 'minced garlic cloves', 'gingerroot', 'sunflower oil', 'milk', 'half-and-half cream', 'coconut milk', 'tomato paste', 'curry powder', 'cumin', 'paprika', 'salt', 'sugar']",13,indian,"['1   medium    onion, finely chopped ', '2   teaspoons    minced garlic cloves', '1   inch   peeled sliced gingerroot (or 1 tsp minced ginger)', '6   tablespoons    sunflower oil', '2   cups    whole milk', '1/2  cup    half-and-half cream', '1/2  cup    coconut milk', '1 (156   ml) can   tomato paste', '3   teaspoons    curry powder', '1/2  teaspoon    cumin', '1   teaspoon    paprika', '1   teaspoon    salt', '2   teaspoons    sugar']",2.0, 1 (185) g
indian chana masala,266068,20,651203,2007-11-16,[],"[244.9, 17.0, 10.0, 13.0, 12.0, 7.0, 10.0]",12,"['cut onion , tomato and green chili', 'grind it in food processor along with ginger and garlic and make paste', 'heat oil in a pan and fry bay leaves for 30 secs', 'add the paste and fry on medium heat until golden brown', 'add red chili powder , turmeric powder , coriander powder , garam masala and salt', 'mix well', 'fry for 2-3 minutes', 'add water enough to make thick gravy', 'bring the gravy to boil', 'add can chick peas', 'stir well and cook over medium heat for 5-7 minutes', 'garnish with chopped green coriander leaves and serve hot']","i make this recipe all the time! watch out, it's very spicy! :) and quite healthy, too. eat the chana masala as a curry over rice or my favourite, straight with paratha. every now and then i like to add about 1 tsp of plain yogurt on top of the chana masala in the bowl, and then add the cilantro on top of that.

i adapted it from:

http://www.recipedelights.com/recipes/vegdishes/chanamasala.htm","['chickpeas', 'onion', 'tomatoes', 'green chili pepper', 'garlic cloves', 'gingerroot', 'bay leaves', 'red chili powder', 'turmeric powder', 'coriander powder', 'garam masala powder', 'olive oil', 'coriander leaves']",13,indian,"['1 (15   ounce) can   chickpeas', '1       onion, chopped ', '1       tomatoes, chopped ', '1       green chili pepper, chopped ', '4 -5       garlic cloves, chopped ', '1   inch    gingerroot, chopped ', '2 -3       bay leaves', '1   teaspoon    red chili powder', '1/2  teaspoon    turmeric powder', '1   teaspoon    coriander powder', '1   teaspoon    garam masala powder', '3   tablespoons    olive oil', '  coriander leaves, for garnishing ']",6.1, 1 (146) g
basmati rice seasoned with garam masala,6582,30,148316,2000-03-06,"['rice', 'pasta']","[304.1, 14.0, 5.0, 3.0, 10.0, 26.0, 16.0]",8,"['preheat oven to 350f', 'in a medium stove-to-oven pot melt butter over medium heat', 'add chopped onions , garlic and garam masala and cook 3 to 5 minutes , stirring until onions are softened', 'add rice and stir until well coated', 'add vegetable stock , salt and pepper to taste', 'bring to a boil', 'cover and bake in the oven until the rice is tender and the stock is absorbed , about 20 to 25 minutes', 'let stand , covered for 5 minutes before serving']",this is a recipe that's delicious and will go well with your favorite curry.,"['basmati rice', 'butter', 'onion', 'garlic', 'garam masala', 'black pepper', 'vegetable broth']",7,indian,"['2   cups    basmati rice', '4   tablespoons    butter', '1   medium-size    onion, chopped ', '1   clove    garlic, minced ', '1   teaspoon    garam masala', '1       salt & freshly ground black pepper, to taste ', '4   cups    vegetable broth']",2.5, 1 (92) g
batatya chi sukki bhaji  sauteed potatoes and bell pepper,75126,55,6357,2003-11-02,['vegetables'],"[297.0, 21.0, 12.0, 0.0, 9.0, 10.0, 13.0]",11,"['boil potatoes till cooked but firm', 'peel and cube them', 'sprinkle with salt , turmeric powder and paprika', 'mix well', 'heat oil in a pan', 'toss in cumin seeds and stir-fry for a few seconds', 'saute the potatoes for a few minutes', 'lower flame and cook covered till lightly roasted and golden', 'stir in the red and green bell peppers', 'cook for a few minutes', 'serve hot with rotis or bread or puris or parathas']",this is from the weekend magazine.,"['potatoes', 'red bell pepper', 'green bell pepper', 'oil', 'cumin seed', 'turmeric powder', 'paprika', 'salt']",8,indian,"['3   medium    potatoes', '1/2      red bell pepper, cubed ', '1/2      green bell pepper, cubed ', '3   tablespoons    oil', '1/2  teaspoon    cumin seed', '1/2  teaspoon    turmeric powder', '1/2  teaspoon    paprika', '  salt']",5.7, 1 (267) g
spicy dal,8629,40,6357,2001-03-14,[],"[27.0, 0.0, 9.0, 0.0, 1.0, 0.0, 1.0]",9,"['pressure cook the toor dal', 'mash well', 'heat 2 tbsp of oil', 'once done , add mustard seeds , cumin seeds and curry leaves', 'next , add the finely chopped onion and dal', 'then , add the achar paste', 'stir', 'garnish with corriander leaves', 'serve hot with rice or rotis']",this dal will be loved by those who enjoy eating spicy food. this dal and achar paste is a combination not to be missed!,"['red gram', 'onion', 'mustard seeds', 'curry leaves', 'cumin seed', 'coriander leaves', 'achar']",7,indian,"['1   cup    red gram (split)', '1       onion', '1/4  teaspoon    mustard seeds (black)', '5       curry leaves', '1/2  teaspoon    cumin seed', '  coriander leaves (for garnishing)', '4 -6   tablespoons    achar (except lime achar)']",0.9, 1 (105) g
peshawari naan bread  bread machine,294013,130,780549,2008-03-25,['breads'],"[550.0, 26.0, 94.0, 20.0, 25.0, 36.0, 29.0]",12,"['add all ingredients to your bread machine in the order your machine recommends', ""if your machine recommends pre-heated liquids , just heat the skimmed milk till it's lukewarm"", 'start your machine on the dough setting', '10-15 minutes before your machine stops mixing and starts proving , add the sultanas', 'preheat your oven to 250c and have 3 shelves in it', 'grease 3 flat oven trays', 'when the bread machine has finished ,', 'tear off a chunk of dough about 1 sixth of the total size and flatten out with the hands to a pear shape about half the size of your tray', ""do not use a roller as the bread probably won't rise"", 'repeat till you have 6 naans on your trays', 'bake in the oven for about 7 minutes , or until the bread just begins to colour', 'the bread can be frozen in bags for later use']","a traditional indian bread from peshawar.
i have used ingredients easily available in uk, together with british measurements.","['skim milk', 'olive oil', 'yogurt', 'egg', 'flour', 'desiccated coconut', 'sultanas', 'sugar', 'salt', 'yeast']",10,indian,"['6   fluid ounces    skim milk', '4   tablespoons    olive oil', '5   fluid ounces    low-fat yogurt (I use zero fat Greek)', '1   large    egg', '1   lb    strong white flour (or extra strong)', '4   ounces    desiccated coconut', '4   ounces    sultanas', '1   tablespoon    sugar', '1   teaspoon    salt', '1 (7   g) packet   bread machine quick-acting active dry yeast']",3.6, 1 (188) g
scrambled eggs with coriander and ginger  ekuri parsri,482963,15,178427,2012-07-10,[],"[208.2, 26.0, 2.0, 16.0, 20.0, 43.0, 0.0]",10,"['break eggs into a deep bowl and mix them lightly with a whisk or fork', 'add the milk , salt and black pepper , stir until all of the ingredients are well combined', 'do not overbeat or allow the egg-and-milk mixture to foam or become frothy', 'in a 10 inch skillet , heat the ghee over moderate heat until a drop of water flicked into it splutters instantly', 'add the ginger and fry for 10 seconds , then add the onions and fry about 1 minute , until they are soft but not brown', 'pour in the beaten egg mixture and sprinkle the top with the fresh chili', 'reduce the heat to the lowest possible point and , stirring constantly with the flat of a table fork or a rubber spatula , cook the eggs until they begin to form soft , creamy curds', 'immediately spread the eggs on a heated serving plate , sprinkle the top with cumin and serve', 'ekuri is traditionally garnished with slices or wedges of fresh tomato and may be further embellished with sprigs or leaves of coriander', 'it is usually accompanied by plain parathas']",found on alleasyrecipes.com. posted for zwt8- india.,"['eggs', 'milk', 'salt', 'black pepper', 'ghee', 'ginger', 'onion', 'coriander', 'turmeric', 'hot red chili peppers', 'cumin']",11,indian,"['6       eggs', '1/4  cup    milk', '1/2  teaspoon    salt', '1/4  teaspoon    fresh ground black pepper', '3   tablespoons    ghee', '1   teaspoon   scraped finely chopped ginger', '3   tablespoons   finely chopped onions', '3   tablespoons   finely chopped coriander (cilantro)', '1/4  teaspoon    turmeric', '2   teaspoons   finely chopped fresh hot red chili peppers (or green)', '1/2  teaspoon    ground cumin']",0.3, 1 (111) g
pepper chicken,13150,10,21967,2001-10-24,['chicken'],"[374.4, 40.0, 4.0, 4.0, 57.0, 35.0, 1.0]",7,"['heat oil in a cooking pan', 'add the mustard seeds and wait until they start to crackle', 'add the chopped onions and pepper and saute till the onions are tender', 'add the ginger garlic paste , saute for a couple of minutes', 'now add the pieces of chicken and salt and mix well', 'cover the lid and let the chicken cook in the juices for 5 minutes , on a low flame', 'uncover and cook for 5 more minutes on a high flame']",this was my grandmothers favorite which was simply passed on. everybody loves it,"['chicken', 'pepper', 'ginger-garlic paste', 'mustard seeds', 'onion', 'salt', 'cooking oil']",7,indian,"['1   kg    chicken (medium pieces)', '3   teaspoons    ground pepper', '1   teaspoon    ginger-garlic paste', '1/2  teaspoon    mustard seeds', '1       red onions or 1       white onion', '  salt', '3   teaspoons    cooking oil']",0.9, 1 (283) g
chickpeas and rice,195593,35,335585,2006-11-14,"['beans', 'rice', 'pasta']","[456.8, 27.0, 2.0, 45.0, 25.0, 32.0, 20.0]",6,"['cook water , rice , thyme , and bay leaf and set aside', 'heat olive oil and half of the butter in a skillet and then add chickpeas', 'when chickpeas start to lightly brown add parsley and the sun-dried tomatoes and cook for an additional 5 minutes', 'add oregano , basil , salt , and pepper and cook for an additional 1-2 minutes', 'remove from heat and mix rice and chickpeas together until rice is a golden color', 'mix in remaining butter and parmesan cheese']",this is a recipe that i got from a vegetarian cookbook and made a few modifications to.  we have fallen for this dish and now make it a few times a month.  my two year old also loves it.  we tried it out on some non-vegetarians and they all loved it.,"['chickpeas', 'butter', 'olive oil', 'parsley', 'sun-dried tomatoes packed in oil', 'basil', 'oregano', 'salt', 'pepper', 'parmesan cheese', 'thyme', 'bay leaf', 'basmati rice', 'water']",14,indian,"['1 (15   ounce) can   chickpeas', '2   tablespoons    butter', '2   tablespoons    olive oil', '1/3  cup    parsley', '2   tablespoons    sun-dried tomatoes packed in oil', '1   teaspoon    dried basil', '1   teaspoon    dried oregano', '1   teaspoon    salt', '1   teaspoon    pepper', '1/3  cup    parmesan cheese', '1   teaspoon    dried thyme', '1       bay leaf', '1   cup    basmati rice (uncooked)', '2   cups    water']",7.1, 1 (304) g
exotic pudding,13111,45,6357,2001-10-22,[],"[194.9, 17.0, 11.0, 5.0, 17.0, 33.0, 5.0]",12,"['boil the milk with sugar', 'prepare the custard by adding a little cold milk to the custard powder in a big-sized bowl', 'once the milk has boiled , remove from flame', 'allow it to cool for 15-20 minutes', 'in the meantime , take a serving dish', 'spread a layer of cake slices in it', 'now , mix the milk into the custard-milk bowl', 'pour some of this on the cake slices', 'now pat this with a layer of biscuit crumbs', 'repeat till 2-3 layers are made in this manner', 'decorate with grated chocolate', 'chill and serve after dinner !']",,"['milk', 'vanilla custard powder', 'chocolate cake', 'marie biscuits', 'sugar', 'milk chocolate candy bar']",6,indian,"['1   liter   fresh milk', '3 -4   teaspoons    vanilla custard powder', '1   packet    chocolate cake', '10       Marie biscuits', '  sugar', '1/2      milk chocolate candy bar']",0.2, 1 (176) g
