name,id,minutes,contributor_id,submitted,tags,nutrition,n_steps,steps,description,ingredients,n_ingredients,cuisine,recipeIngredient,fiber,serving_size
french bread rolls,37686,325,133174,2002-08-19,['breads'],"[290.2, 4.0, 10.0, 25.0, 17.0, 6.0, 18.0]",16,"['dissolve yeast in mixer with water', 'add melted butter , sugar , dry milk , salt and pepper', 'whisk to incorporate', 'add 4 cups of flour and mix with dough hook', 'add additional flour until dough leaves the side of the bowl', 'knead dough by hand with a little flour until it is smooth and elastic let rise in greased bowl , covered for about 2 hours until doubled', 'at this point the dough can be refrigerated overnight or for 2 days', 'bring to room temperature before shaping', 'punch down and let rise until doubled again , about 2 hours', 'shape into 3 oz rolls , let rise covered for 45 minutes to 1 hour', 'sprinkle with rye flour , slash with lame quite deeply , sprinkle with salt', 'bake at 450 for 20-25 minutes , reduce heat to 400 and bake another 5 minutes', 'turn off oven and let rolls sit to crisp for another 5 minutes', 'cool at least 20 minutes', 'store rolls in plastic bag', 'to recrisp , put into 400 oven for 5 minutes']","source: ""fine cooking""  this is one of my recently adopted recipes.  i prepared it and it is wonderful.  the end result are rolls with a crispy crust and soft chewy center.  i always add wheat gluten when adding the flour.  this produces a superior quality of bread so i am including it in the list of ingredients.","['butter', 'yeast', 'sugar', 'water', 'nonfat dry milk powder', 'flour', 'wheat gluten', 'salt', 'black pepper']",11,french,"['2   tablespoons    unsalted butter, melted ', '2 1/4  teaspoons    dry yeast', '2   teaspoons    sugar', '2   cups    water, 70 degrees ', '1 1/4  ounces    nonfat dry milk powder, 1/2 cup ', '6   cups    all-purpose flour', '5   teaspoons    wheat gluten', '1   tablespoon    salt', '  black pepper, to taste  (I added 1 teaspoon coarse ground.)', '1   cup    rye flour', '  coarse salt, for sprinkling ']",3.1,
chicken  thyme and shallot casserole,409851,95,287420,2010-01-23,['chicken'],"[671.3, 76.0, 5.0, 18.0, 60.0, 91.0, 5.0]",8,"['heat the oil in a large frying pan over a medium heat', 'add the bacon and fry until just crisp', 'remove and set aside', 'in the same pan , brown the chicken thighs on all sides then transfer to a large casserole dish , sprinkle with the flour and set aside', 'add the shallot halves , the garlic and the mushrooms to the frying pan and brown for 5 minutes', 'spoon the mixture into the casserole dish then pour over the white wine', 'add the thyme , season with salt and pepper , cover and cook on a low heat for 1 hour to 1 1 / 4 hours until the chicken is cooked and the sauce is thickened', 'just before serving , stir in the cream , warm through , without boiling then serve garnished with the chopped parsley leaves']","hearty, warming and very tasty family food.","['olive oil', 'bacon', 'chicken', 'flour', 'shallots', 'garlic cloves', 'brown button mushrooms', 'white wine', 'thyme', 'parsley', 'heavy cream']",11,french,"['1   tablespoon    olive oil', '6   slices    streaky bacon, finely sliced ', '8       chicken thighs', '2   tablespoons    all-purpose flour', '14   ounces    shallots, peeled and halved ', '2       garlic cloves, finely sliced ', '9   ounces    brown button mushrooms', '1 1/4  cups    white wine', '4   sprigs    thyme, leaves picked ', '2   ounces    parsley, leaves only, chopped ', '3/4  cup    heavy cream']",0.8,
low fat tomato and zucchini summer gratin,68462,65,91392,2003-08-06,['vegetables'],"[306.1, 16.0, 37.0, 3.0, 32.0, 27.0, 14.0]",6,"['spray a 9 x13 pan with pam and scatter the bulgur over the bottom , to soak up excess juice', ""cover the bottom of the pan with zucchini slices , in a single layer , you are making levels , like lasagna , so don't worry about leftovers"", 'cover the zucchini with tomato slices , salt , pepper , crushed garlic , a good sprinkling of chopped parsley , and a bit of cheese', 'same with the eggplant', 'start again , making the same layers in the same order until you are out of ingredients , and ending with some cheese and a touch of olive oil', 'bake in a 375-400 degree preheated oven about 40-45 minutes , it depends on the thickness of the slices of your veggies , so be sure to check']","a tasty, healthy and low fat dish for summer. this is my french husband's recipe, he made it up himself, and he hopes people will try it and like it. it is a fast, cheap, good and good-for-you dinner. we eat it as a main course, but it would be equally good as a side dish with grilled meat or fish.","['bulgur', 'zucchini', 'tomatoes', 'eggplant', 'garlic', 'swiss cheese', 'parsley', 'salt', 'pepper', 'olive oil']",10,french,"['1/2  cup    bulgur', '2   lbs    zucchini, peeled and thinly sliced ', '2   lbs    tomatoes, thinly sliced ', '1       eggplant, peeled and thinly sliced ', '5      cloves crushed garlic', '6   ounces    swiss cheese, shredded ', '4   tablespoons    parsley, chopped ', '  salt, to taste ', '  pepper, to taste ', '2   teaspoons    olive oil']",9.3,
orange crescent swirls,94879,30,55380,2004-07-02,"['breads', 'fruit']","[84.9, 3.0, 21.0, 4.0, 3.0, 4.0, 4.0]",13,"['heat oven to 375f spray 12 x 1 / 2 inch pizza pan with nonstick cooking spray', 'in small saucepan , combine brown sugar , margarine , orange peel and juice', 'mix well', 'cook and stir over med heat until bubbly', 'set aside', 'remove dough from each can but do not unroll', 'leave as a log / roll', 'cut each roll into 12 slices', 'arrange slices evenly in prepared pan', 'spoon brown sugar mixture evenly over rolls', 'bake at 375 for 13-15 min or until golden brown', 'remove rolls from pan with spatula', 'serve warm']","these simple little orange rolls begin with refrigerated crescent dough. quick to make but sure to make a good impression early in the morning! from the foote creek bed & breakfast in aberdeen, south dakota where speedy but impressive food is a must first thing each day. ;o) if you are living in warmer climates, it may help to place the dough in the freezer for a few minutes before slicing.","['sugar', 'butter', 'orange zest', 'orange juice', 'crescent dinner rolls']",5,american,"['1/2  cup   firmly packed brown sugar', '2   tablespoons    butter or 2   tablespoons    margarine', '1   tablespoon    orange zest', '3   tablespoons    orange juice', '2 (8   ounce) cans   refrigerated crescent dinner rolls']",0.7,
sunday chicken,31422,70,37779,2002-06-17,['chicken'],"[767.9, 84.0, 0.0, 9.0, 127.0, 75.0, 0.0]",4,"['cut lemon in half , and squeeze juice over chicken', 'put lemon halves in cavity of chicken', 'brush oil on chicken , and sprinkle with creole seasoning and rosemary', 'bake at 400 degrees for 45 minutes to an hour or until done , basting occasionally with pan drippings']",this recipe is from emeril lagasse. very easy and so delicious.,"['lemon', 'chicken', 'olive oil', 'creole seasoning', 'rosemary']",5,american,"['1   large    lemon', '1 (3   lb)    broiler-fryer chickens', '1   tablespoon    olive oil', '1   tablespoon    creole seasoning', '1   tablespoon   chopped fresh rosemary or 1   tablespoon    dried rosemary']",1.3,
roast turkey with old fashioned bread stuffing,45678,300,46660,2002-11-12,[],"[1475.0, 112.0, 15.0, 42.0, 320.0, 120.0, 10.0]",28,"['for stuffing , in a medium saucepan cook celery , mushrooms , and onion in butter until tender but not brown , remove from heat', 'stir in sage , pepper , and salt', 'place dry bread cubes in a large mixing bowl , add onion mixture', 'drizzle with enough broth or water to moisten , tossing lightly', 'season body cavity of turkey with salt', 'spoon some stuffing loosely into the neck cavity', 'pull the neck skin to the back , fasten with a skewer', 'lightly spoon more stuffing into the body cavity', 'tuck the ends of the drumsticks under the band of skin across the tail', 'if the band of skin is not present , tie the drumsticks securely to the tail', 'twist wing', 'place turkey , breast side down , on a rack in a shallow roastng pan', 'brush with oil', 'cover turkey loosely with foil', 'roast turkey in a 325 degree oven for 3 1 / 4 to 3 1 / 2 hours , or until a meat thermometer placed into the center of a thigh reads 180 degrees', 'make sure center of stuffing reads 165 degrees', 'after about 1 1 / 2 hours , turn the turkey over so that it is breast side up', 'brush breast side with oil', 'after 2 1 / 2 hours , cut loose drumsticks so that thighs will cook evenly', 'when done , drumsticks should move very easliy in their sockets and their thickest parts should feel soft when pressed', 'uncover the last 30 minutes of roasting', 'to make dry bread cubes: cut bread into 1 / 2 inch squares', 'place in a brown paper bag and close loosely', 'let stand 3-4 days , mixing up by hand each day until thoroughly dry', 'or , spread bread cubes onto a large cookie sheet in a single layer and bake at 300 degrees 10-15 minutes or until dry , stirring twice', 'cool', 'i highly recommend using homemade white bread for the bread cubes', 'you will be amazed at the difference in texture !']","i used this recipe from better homes and gardens for my first year of making thanksgiving dinner. judging by the results, no one knew that i hadn't cooked this meal a million times before. the turkey was perfectly moist and the stuffing was incredible! if serving a large crowd, i would double the stuffing! i ran out last year because the bird needed it all, and had to make an extra casserole of stovetop. it didn't even compare to the homemade! this recipe is well worth the effort, and your family will thank you! you don't have to mess with the fancy turkey lacing, all i did was fasten the back and legs shut with a metal skewer and it turned out fine. prep time does not include making bread cubes.","['celery', 'mushrooms', 'onion', 'butter', 'sage', 'pepper', 'salt', 'dry bread', 'chicken', 'turkey', 'cooking oil']",11,american,"['1   cup   chopped celery', '1   cup   sliced fresh mushrooms', '1/2  cup   chopped onion', '1/3  cup    butter', '1   teaspoon    ground sage', '1/4  teaspoon    pepper', '1/8  teaspoon    salt', '8   cups    dry bread, cubes  (I will tell you how to make these at the end of the cooking directions)', '1/2-3/4  cup    chicken broth or 1/2-3/4  cup    water', '10 -12   lbs    turkey', '  cooking oil']",2.1,
cheesy mini meatloaves,382063,55,415907,2009-07-19,"['beef', 'vegetables']","[301.9, 23.0, 76.0, 17.0, 33.0, 35.0, 8.0]",8,"['preheat oven to 350 degrees', 'beat egg and milk together', 'add cheese , oats , onion , salt , & pepper to milk / egg mixture', 'mix in ground beef with your hands until all ingredients are incorporated well', 'shape into 8 loaves and place into a greased 9x13 pan', 'mix all sauce ingredients together and spoon over loaves', 'you may want to make extra sauce for after its done cooking !', 'place in 350 degree oven , uncovered , for 45 minutes']","this is a nice twist on the normal meatloaf recipes.. 8 mini meatloaves with a yummy sauce!!
i have made this several times and recently added fresh mushrooms to meat mixture before shaping into loaves and it was fantastic... endless possibilities!","['beef', 'cheddar cheese', 'egg', 'oats', 'onion', 'milk', 'salt', 'ketchup', 'sugar', 'yellow mustard']",10,american,"['1   lb    ground beef', '1   cup    cheddar cheese', '1       egg', '1/2  cup    quick oats', '1   medium    onion, finely chopped ', '3/4  cup    milk', '1   teaspoon    salt & pepper', '3/4  cup    ketchup', '1/2  cup    brown sugar', '1   tablespoon    yellow mustard']",0.8,
the famous pool room coleslaw burgers,13274,35,16459,2001-10-26,[],"[5539.6, 64.0, 4739.0, 776.0, 135.0, 16.0, 432.0]",5,"['put all ingredients in a large pan and just bring to a boil', 'put slaw and burger on bun', 'the traditional way of eating this is without any other condiments', 'put the rest of the slaw in jars and seal', 'it does not have to be refrigerated until opened']","in the little southern town of fayetteville, tennessee, people come from all around to have these burgers. people who have grown up in the area but have moved away make special trips to get them. there are two different pool rooms on the square (bill's pool room and honey's). however, you can find these burgers at any greasy spoon in the lincoln county area.","['cabbage', 'mustard', 'pepper', 'onion', 'sugar', 'salt', 'hamburger patty', 'hamburger bun']",9,american,"['1   gallon   chopped head of cabbage', '1   quart    mustard', '1   tablespoon    pepper', '3   large    onions, chopped ', '1   cup    brown sugar', '4 1/2  cups    sugar', '1   tablespoon    salt', '  hamburger patty, grilled ', '  hamburger bun']",77.9,
cat scat cookies,142879,35,68460,2005-10-26,[],"[1282.8, 104.0, 283.0, 20.0, 46.0, 206.0, 55.0]",11,"['place honey in a heat-proof bowl and microwave on high heat until bubbles appear , about a minute', 'add butter and stir until combined', 'add flour , cocoa powder , egg and vanilla and stir to combine', 'form dough into small , log-shaped cookies of random lengths to resemble cat dukies', 'place logs on a baking sheet and refrigerate until firm', ""roll chilled logs in grape nuts until cereal adheres to the dough -- the cookies don't have to be totally covered with the cereal , they should look sort of random or realistic"", 'place on ungreased baking sheets and bake in a preheated 350 oven for 10-15 minutes or until lightly browned', 'remove from oven and place cookies on a wire rack to cool completely', 'line a clean litter box with foil and cover bottom with additional grape nuts cereal', ""add cookies to the 'litter' and serve with a new litter scoop"", 'lol']","these look like so much fun for a halloween or children's party.  for best visual results, serve the cookies in a new, washed!, kitty litter pan, lined with foil and serve the cookies with a new, washed kitty litter scoop.  chicago sun-times.","['honey', 'butter', 'flour', 'cocoa powder', 'egg', 'vanilla', 'cereal']",7,american,"['1/2  cup    honey', '2/3  cup    butter', '2   cups    whole wheat flour', '1/3  cup    cocoa powder', '1       egg', '1   teaspoon    vanilla', '  Grape-nuts cereal']",19.6,
chorizo and black bean soup with eggs,498752,30,50509,2013-04-10,"['beans', 'pork']","[639.9, 49.0, 7.0, 35.0, 79.0, 54.0, 16.0]",9,"['heat oil in dutch oven or heavy pot and add the chorizo , cooking until it it crisps around the edges', 'add the onion , chili peppers , garlic , and spices', 'cook , stirring , for a few minutes to bloom the spices', 'puree 2 cups of the beans with 1 cup of the chicken broth', 'i used my stick blender', 'add to the pot with the remaining beans and broth and simmer over medium heat for a few minutes to thicken', 'meanwhile , poach or fry the eggs', 'to serve , line the sides of the bowls with a few tortilla chips', 'pour in the soup , top with the eggs and with the optional garnishes you desire']","this recipe is from every day with rachael ray, which i modified to try to reduce the sodium. it's really quite tasty, and the egg is a nice touch - don't be afraid to try it!","['olive oil', 'sausage', 'onion', 'serrano peppers', 'garlic cloves', 'ancho chile powder', 'cumin', 'coriander', 'salt', 'black beans', 'chicken', 'eggs', 'queso fresco', 'tomato', 'scallion', 'tortilla chips', 'pickled jalapeno pepper', 'cilantro']",18,american,"['1   tablespoon    olive oil or 1   tablespoon    vegetable oil', '1/2  lb   raw chorizo sausage (removed from casings and crumbled or chopped)', '1       onion, chopped ', '2       serrano peppers (thinly sliced or chopped) or 2       jalapenos (thinly sliced or chopped)', '3 -4       garlic cloves (thinly sliced or chopped)', '1   tablespoon    dried ancho chile powder', '1   teaspoon    ground cumin', '1   teaspoon    ground coriander', '  salt and pepper (optional, I did not use)', '4   cups   cooked black beans (or use canned)', '3   cups    low sodium chicken broth', '4       eggs', ' shredded queso fresco or  other mild cheese', '  diced tomato', ' sliced scallion', '  tortilla chips', '  pickled jalapeno pepper', ' chopped cilantro']",16.5,
crock pot chicken and cherries jubilee,44247,495,10404,2002-10-25,"['fruit', 'chicken']","[430.4, 33.0, 26.0, 12.0, 68.0, 39.0, 4.0]",17,"['wash and pat dry chicken', 'in a large skillet melt butter and brown chicken', 'lightly salt and pepper chicken and place in the crock-pot', 'pour 1 / 2 of the cherry juice into the pan along with the chili sauce and bouillon base', 'stir to loosen bits and pour over chicken', 'cover crock-pot and cook on low for 7-8 hours', 'remove chicken from crock-pot , cover and keep warm', 'pour juice from crock-pot into a large saucepan', 'skim off fat and discard', 'add the sherry and remaining juice', 'heat over medium high heat until a gentle boil is reached', 'boil for 5 minutes stirring often', 'stir together the cornstarch and water', 'whisk into the cherry juice mixture until thickened', 'add the cherries and heat through', 'pour the warmed brandy over the cherry sauce and ignite', 'pour over chicken and serve']",a great dish for special occasions thats so easy to prepare and tastes great! i found the original recipe on the net and adjusted it to my aunt's recipe. this one's a keeper!,"['chicken', 'butter', 'salt', 'bing cherries', 'heinz chili sauce', 'dry sherry', 'cornstarch', 'water', 'brandy']",10,american,"['2       fryer chickens, cut up  or 3   lbs   of bone in chicken breasts', '4   tablespoons    butter', '  salt and pepper', '1 (16   ounce) can  pitted bing cherries', '1   cup    Heinz Chili Sauce', '2   teaspoons    chicken bouillon, base mix ', '1/4  cup   pale dry sherry', '2   tablespoons    cornstarch', '2   tablespoons    water', '4   tablespoons    brandy']",1.6,
cherry red raspberry pie,185014,65,169969,2006-09-07,['fruit'],"[5065.2, 365.0, 1051.0, 86.0, 98.0, 497.0, 230.0]",19,"['pie crust - combine the flour and the cake flour', 'cut in shortening until it resembles coarse crumbs', 'beat together remaining ingredients and stir into flour until it is just incorporated', 'form into a disk , wrap in plastic wrap and chill for at least an hour', 'roll out about 1 / 3 of the dough between 2 sheets of wax paper and line pie dish', 'you will need a top as well', 'preheat oven to 350', 'filling - thaw frozen raspberries and pour juice into a one-cup measuring cup', 'add the reserved cherry juice to make one cup of liquid', 'in a saucepan over medium heat , combine sugar , cornstarch , butter , salt , and one cup of the raspberry / cherry juice', 'stir', 'add cherries and cook over medium heat until thick and clear', 'remove from heat', 'add melted butter to the raspberries and very gently fold raspberries into saucepan', 'pour into pastry-lined pie dish', 'add top crust', 'seal edges , moisten top with hot milk and sprinkle with sugar', 'cut steam vents', 'bake 350 for about 45 minutes']","i watched the national pie championships held by the american pie council on tv last night and had to look this recipe up today! it was torture watching the judges eat this delicious looking pie! they raved about her crust as well. this pie won ""best of show"" for phyllis bartholomew. in fact she pretty much cleaned up in all the categories. it looks pretty simple and clear-cut, i guess this is a good example of less is more. her recipe uses canned sour cherries, but if you wish to substitute fresh sweet cherries, you can always reduce the amount of sugar and add a little lemon juice to taste...it should work fine with this recipe. this pie is extra pretty with a lattice top.","['flour', 'butter', 'egg', 'cider vinegar', 'salt', 'water', 'raspberries', 'sour pitted cherries', 'sugar', 'cornstarch', 'milk']",13,american,"['2   cups    flour', '1   cup    cake flour', '1   cup    Butter Flavor Crisco', '1      whole egg', '1   tablespoon    cider vinegar', '1/2  teaspoon    salt', '1/3  cup    ice water', '1 (10   ounce) package  red frozen raspberries (reserve juice)', '2   cups   of canned sour pitted cherries (drained, juice saved)', '1   cup    sugar', '3   tablespoons    cornstarch', '2   tablespoons    butter, melted ', '1/4  teaspoon    salt', '  milk (to top the crust)', '  sugar (to top the crust)']",25.8,
pioneer woman cajun chicken pasta,411705,25,644191,2010-02-04,"['pasta', 'chicken']","[804.1, 62.0, 18.0, 7.0, 88.0, 85.0, 20.0]",29,"['cook pasta according to package directions', 'drain when pasta is still al dente', 'do not overcook !', 'sprinkle 1 1 / 2 teaspoons cajun spice over chicken pieces', 'toss around to coat', 'heat 1 tablespoon oil and 1 tablespoon butter in a heavy skillet over high heat', 'add half the chicken in a single layer', 'do not stir', 'allow chicken to brown on one side , about 1 minute', 'flip to the other side and cook an additional minute', 'remove with a slotted spoon and place on a clean plate', 'repeat with remaining chicken', 'remove chicken , leaving pan on high heat', 'add remaining olive oil and butter', 'when heated , add peppers , onions , and garlic', 'sprinkle on remaining cajun spice , and add salt if needed', 'cook over very high heat for 1 minute , stirring gently and trying to get the vegetables as dark / black as possible', 'add tomatoes and cook for an additional 30 seconds', 'remove all vegetables from the pan', 'with the pan over high heat , pour in the wine and chicken broth', 'cook on high for 3 to 5 minutes , scraping the bottom of the pan to deglaze', 'reduce heat to medium-low and pour in cream , stirring / whisking constantly', 'cook sauce over medium-low heat for a few minutes , until cream starts to thicken the mixture', 'taste and add freshly ground black pepper , cayenne pepper , and / or salt to taste', 'sauce should be spicy !', 'finally , add chicken and vegetables to sauce , making sure to include all the juices that have drained onto the plate', 'stir and cook for 1 to 2 minutes , until mixture is bubbly and hot', 'add drained fettuccine and toss to combine', 'top with chopped fresh parsley and chow down !']",from one of my favorite websites: the pioneer woman cooks.,"['chicken', 'cajun seasoning', 'fettuccine', 'olive oil', 'butter', 'green bell pepper', 'red bell pepper', 'onion', 'garlic cloves', 'roma tomatoes', 'white wine', 'heavy cream', 'cayenne pepper', 'black pepper', 'salt', 'parsley']",17,american,"['6       chicken breasts, Cut Into Cubes ', '3   teaspoons    cajun seasoning, More To Taste ', '1   lb    fettuccine', '2   tablespoons    olive oil', '2   tablespoons    butter', '1      whole green bell pepper, Seeded And Sliced ', '1      whole red bell pepper, Seeded And Sliced ', '1/2     whole large red onion, Sliced ', '3       garlic cloves, Minced ', '4      whole roma tomatoes, Diced ', '2   cups    low sodium chicken broth', '1/2  cup    white wine', '1   cup    heavy cream', '  cayenne pepper', '  fresh ground black pepper, To Taste ', '  salt', ' chopped fresh parsley, To Taste ']",3.9,
creamy sweet potato salad,46316,25,28201,2002-11-16,"['salads', 'vegetables']","[126.0, 1.0, 26.0, 4.0, 6.0, 1.0, 8.0]",7,"['in a bowl , blend mayonnaise , buttermilk , lemon juice , mustard and sugar until smooth', 'in a large bowl , combine sweet potatoes , peas , pepper and onions', 'pour dressing over all', 'toss to blend', 'chill 2 hours or overnight', 'to serve , spoon salad into a large bowl lined with spinach', 'top with bacon']","refreshing and colorful, this novel combination is a tasty alternative to regular potato salad! prep time does not include chill time.","['mayonnaise', 'butter', 'lemon juice', 'dijon mustard', 'sugar', 'potatoes', 'peas', 'green peppers', 'onion', 'bacon']",10,american,"['2   cups    mayonnaise', '1/3  cup    buttermilk', '2   tablespoons    lemon juice', '1   tablespoon    Dijon mustard', '1   teaspoon    sugar', '3   lbs    sweet potatoes, cooked,peeled and cubed ', '1   cup    peas', '1/2  cup   chopped green peppers or 1/2  cup    sweet red pepper', '1/2  cup   sliced green onion', '3   slices    bacon, cooked and crumbled ']",4.4,
snooty modern french toast,153246,13,272752,2006-01-25,['eggs-dairy'],"[141.7, 2.0, 22.0, 9.0, 18.0, 2.0, 7.0]",7,"['spray and begin heating a nonstick skillet on med-high', 'whisk together egg whites , spices , vanilla , sugar and milk in a bowl or small dish', 'slice your bread however you desire', 'dip and soak your bread until most of the mixture is absorbed', 'cook bread slices on the skillet , flipping two or three times , until nice and crispy on the outside', 'this may take up to 4-6 minutes per side , since the bread has absorbed more than normal french toast bread', 'put banana slices on top of bread , and , if you feel like adding the calories , a bit of maple syrup']","old-style french toast is too decadent to fit into most diets, especially them snooty frenchmen.  so here's my favorite way to make my cake and eat it too.  i use arnold's 100% whole wheat, which soaks up the mixture beautifully and, with each slice having 90cal, 3g fiber, and 4g protien, means two slices stack up pretty well against your favorite health cereal.","['wheat bread', 'egg whites', 'skim milk', 'cinnamon', 'nutmeg', 'vanilla extract', 'sugar', 'banana']",8,american,"['2   slices   100% whole wheat bread', '2       egg whites', '1/2  cup    skim milk', '1/8  teaspoon    cinnamon', '1/8  teaspoon    nutmeg', '1/2  teaspoon    vanilla extract', '1   teaspoon    sugar, I find it sweet enough from the milk  (optional)', '1/2      banana, sliced ']",2.8,
